Datetime,Tweet Id,Text,User
2/23/2017 23:19,8.34906E+17,RT @gatesfoundation: Zero is the most magical number we know! It’s thrilling to be nearing the day when no kids will be crippled by polio h…,billgates
2/23/2017 13:07,8.34751E+17,"Whether in business or at McDonald’s, Warren loves a deal. We've brought this idea to saving children's lives:… https://t.co/Ej8H4ZSMXm",billgates
2/22/2017 21:06,8.3451E+17,"Saving children’s lives is at the heart of our work. @melindagates explains three simple, proven lifesavers:… https://t.co/Y7hMQQ8TEi",billgates
2/22/2017 18:13,8.34466E+17,Nutrition is the biggest missed opportunity in global health. Here's how it could unleash waves of human potential:… https://t.co/lcewQdKOyD,billgates
2/22/2017 13:15,8.34391E+17,Malnutrition destroys the most human potential on the planet. We’re funding research in this area and urging govern… https://t.co/DeyUfrqCMP,billgates
2/21/2017 18:09,8.34103E+17,"What has happened to extreme poverty over the last 25 years?

Check your answer here: https://t.co/tt7ywSalKj",billgates
2/20/2017 16:29,8.33715E+17,Our friend @WarrenBuffett is one of the greatest investors of all time. This may be his best investment:… https://t.co/c48D50l2G3,billgates
2/19/2017 14:02,8.33316E+17,"Each year, 1 million babies die on the day they are born. We’re funding new research to better understand why:… https://t.co/5ibCQ6noFY",billgates
2/18/2017 15:54,8.32982E+17,"For every $1 spent on childhood vaccines, you get $44 in benefits. You can’t beat that deal: https://t.co/8Xnu3L5bSh https://t.co/4TOBXgRKuB",billgates
2/17/2017 23:44,8.32738E+17,.@IISuperwomanII challenged me to prove the world is becoming a better place. Find out how I did… https://t.co/5XhQkJqtIs,billgates
2/17/2017 14:42,8.32601E+17,How countries like Rwanda have achieved such incredible improvements in reducing child deaths:… https://t.co/9A2COLqVTG,billgates
2/16/2017 21:12,8.32337E+17,This is the most beautiful chart in the world: https://t.co/4R24thLJCS https://t.co/LT5BSnzAri,billgates
2/16/2017 13:14,8.32216E+17,"#TBT In 1993 Melinda and I went to Africa to see the wildlife, and were startled by the poverty:… https://t.co/HJ4zbsyuhL",billgates
2/15/2017 21:00,8.31971E+17,I love numbers. This is one of my favorites: https://t.co/oEGEBkUjf0 https://t.co/BspFqicKyG,billgates
2/15/2017 16:50,8.31909E+17,The end is in sight. Thanks for your support @JohnCena @Rotary @EndPolioNow.,billgates
2/15/2017 14:20,8.31871E+17,RT @melindagates: Optimism isn’t the passive expectation that things will get better. It’s the conviction we can make things better. https:…,billgates
2/14/2017 18:10,8.31566E+17,"In 2006, @WarrenBuffett entrusted us with the biggest single gift anyone ever gave anybody for anything:… https://t.co/0R4adQMg9v",billgates
2/14/2017 10:01,8.31443E+17,The best investment any of us can ever make is in the lives of others. The returns are tremendous…https://t.co/nlMNaWaDo1,billgates
2/12/2017 17:47,8.30836E+17,Hans Rosling was just as fascinating offstage as he was on it. Our remembrance of this remarkable man… https://t.co/1nZOzTSSCp,billgates
2/7/2017 20:03,8.29058E+17,"A great friend, educator and true inspiration for our work. Melinda and I are saddened by the loss of Hans Rosling: https://t.co/qZ0bH8PKoC",billgates
2/3/2017 18:14,8.27581E+17,Ric Weiland was an integral part of @Microsoft's success. This is a great piece on his legacy as a philanthropist:… https://t.co/uK3ENwOSmq,billgates
2/2/2017 17:32,8.27208E+17,"These students’ energy, passion, and curiosity help fuel my optimism about our world... https://t.co/lfwAYh4kvv https://t.co/5LH1H2NP4r",billgates
1/29/2017 14:14,8.25709E+17,"I hope everyone, even those who think they know Warren well, will watch this film. It premieres tonight on @HBO:… https://t.co/dkecgBT1Pk",billgates
1/27/2017 20:03,8.25072E+17,I’m on Facebook Live with my friends @WarrenBuffett and @CharlieRose to discuss our hopes for the future: https://t.co/cBBiZcddhb,billgates
1/25/2017 18:45,8.24327E+17,"I’m optimistic today's investment in @IHME_UW, one of the largest in our foundation's history, will help save lives. https://t.co/XHLxyz5uus",billgates
1/24/2017 21:04,8.24E+17,"Great stats, @johngreen. I share your excitement. We’re so close... https://t.co/zGMehhRmdp",billgates
1/23/2017 0:23,8.23325E+17,Congratulations @jeffraikes. Stanford is lucky to have you.,billgates
1/19/2017 17:13,8.2213E+17,We’ll never know exactly when a new disease outbreak will emerge. But that shouldn’t be an excuse for inaction. https://t.co/Izwm24a17K,billgates
1/19/2017 13:27,8.22073E+17,Today @wef I'm excited to participate in the launch of an organization that will help prepare for future epidemics. https://t.co/Z9cZrURxX6,billgates
1/18/2017 17:57,8.21779E+17,Viruses move at incredible speed…That’s why we need to start developing vaccines before the next epidemic:… https://t.co/1tvdVIYm68,billgates
1/17/2017 19:56,8.21446E+17,This fascinating #dataviz looks at how vaccine innovation could outpace the spread of diseases:… https://t.co/vWivEBXr1G,billgates
1/16/2017 13:43,8.2099E+17,Dr. Martin Luther King Jr. lived his life serving others. Melinda reflects on how to follow his example. #MLKDay https://t.co/qTlPELVQng,billgates
1/12/2017 5:10,8.19411E+17,Here are five things that make me more optimistic than ever about Africa: https://t.co/biwbqy6ivx https://t.co/2DipMgNZVm,billgates
1/10/2017 4:13,8.18672E+17,There’s a lot to be optimistic about in 2017…life is getting better for more people on our planet. Especially here. https://t.co/USIqdKHdAR,billgates
1/8/2017 16:22,8.18131E+17,"I had a first in 2016…I sniffed poop perfume. Trust me, there’s a good story behind it: https://t.co/yPO2QdFOeM https://t.co/Tgz7jEvAwR",billgates
1/7/2017 14:42,8.17743E+17,I got to learn about this fascinating HIV-prevention technology first-hand. It could help prevent new infections. https://t.co/cMS0gXi8z1,billgates
1/5/2017 13:37,8.17002E+17,"When I was in my 20s and early 30s, I was fanatical about software. Now, I’m learning from these fanatics:… https://t.co/WGdbZIdGzm",billgates
12/30/2016 14:52,8.14847E+17,An excellent profile... @HansRosling is a global health hero: https://t.co/V0x30hSBKV https://t.co/7l3pQ0V5Is,billgates
12/29/2016 15:46,8.14498E+17,"A mobile-money service, M-Pesa, has helped lift hundreds of thousands of Kenyans out of poverty:… https://t.co/5FLbvN9b7s",billgates
12/28/2016 15:18,8.14128E+17,University of Washington president @amcauce is a visionary leader. She is a great asset to our community:… https://t.co/f4zSwbyT0l,billgates
12/27/2016 14:14,8.1375E+17,"In the field of energy, one of my best teachers has been @KenCaldeira. He is a brilliant, patient teacher:… https://t.co/14krA8Ymtl",billgates
12/26/2016 15:13,8.13402E+17,"Two weeks ago, we launched @btenergy. This roadmap will guide our investment decisions over the next two decades:… https://t.co/vUrZLAzh4Z",billgates
12/23/2016 16:32,8.12335E+17,Washington State Teacher of the Year @nate_bowling is a great example of what it takes to be an effective teacher:… https://t.co/kDcoNRMHCJ,billgates
12/23/2016 3:15,8.12134E+17,"I recently had a chance to catch up with one of India’s best-known entrepreneurs, philanthropists, and thinkers:… https://t.co/wK94fRMSm9",billgates
12/22/2016 14:36,8.11943E+17,"At 92, Jimmy Carter hasn’t slowed down. His life should be an inspiration to all of us: https://t.co/NJRUyxrx73 https://t.co/xkhj7NHy6r",billgates
12/22/2016 3:35,8.11777E+17,A shot at life. India’s incredible effort to make vaccines affordable and accessible for all its children:… https://t.co/BdCCtNub92,billgates
12/20/2016 18:55,8.11284E+17,I had the opportunity to meet with many gifted people this year. I hope they inspire you as much as they have me... https://t.co/LWsLuvh9i1,billgates
12/19/2016 13:56,8.10846E+17,The African continent is changing rapidly. These maps show remarkable progress: https://t.co/nVEOW6ruYg via… https://t.co/Q0nVr1HIkg,billgates
12/17/2016 15:03,8.10138E+17,"I try to read about a book a week on average. Even when my schedule is out of control, I carve out time for reading… https://t.co/NYfymAh0FD",billgates
12/14/2016 22:37,8.09165E+17,New genome technologies are at the cusp of affecting all of us in profound ways. This book is an excellent guide:… https://t.co/H6iVNiLnUl,billgates
12/14/2016 17:31,8.09088E+17,“These are questions no parent should have to ask.” A stirring piece by my friend @PStonesifer on fighting hunger. https://t.co/Tani71v83P,billgates
12/14/2016 0:25,8.0883E+17,RT @vkhosla: Markets need innovation to advance. Excited to invest in @btenergy fund to bring breakthrough tech to energy fund   https://t.…,billgates
12/13/2016 23:02,8.08809E+17,.@richardbranson You’ve always been one for big ideas. I’m excited to partner with you on this venture…,billgates
12/13/2016 22:42,8.08804E+17,"RT @ErnestMoniz: This new #cleanenergy fund is a big deal. Unless we invest in innovation, we leave the best breakthroughs to others. https…",billgates
12/13/2016 22:20,8.08799E+17,I’m grateful for your commitment and I look forward to working with you… https://t.co/h3iFc9foTK,billgates
12/13/2016 21:11,8.08781E+17,".@POTUS Thank you for your support. More affordable, reliable energy means better lives and stronger economies.",billgates
12/12/2016 18:07,8.08373E+17,".@btenergy launches a $1B investment fund for reliable, affordable, emissions-free energy... https://t.co/ajSllCHpy0",billgates
12/12/2016 1:01,8.08114E+17,I discuss with @qz a major announcement for @btenergy and our vision for the future... https://t.co/VJMZypx0X3,billgates
12/9/2016 15:12,8.07241E+17,The Grid by Gretchen Bakke is a book about mundane stuff that is actually fascinating: https://t.co/2EXpdQXULM https://t.co/UhobzmmJrx,billgates
12/8/2016 20:36,8.06961E+17,.@rajpanjabi’s commitment to help the world’s poorest is inspiring. This is a well-deserved honor. https://t.co/MO1hmddMjY,billgates
12/8/2016 14:16,8.06865E+17,I’ve loved tennis ever since I was a kid. I enjoyed David Foster Wallace’s dazzling essays on the sport:… https://t.co/uySwnqKook,billgates
12/8/2016 0:32,8.06658E+17,“Scientists are like entrepreneurs: They have an eye for spotting unrealized opportunities.” Great piece via @MIT… https://t.co/2d1hKuLIqB,billgates
12/7/2016 20:13,8.06592E+17,".@khanacademy is the best way to learn online. Help them continue to provide free, world-class educational resources https://t.co/Bz3cehnTsf",billgates
12/7/2016 17:43,8.06555E+17,.@Nike co-founder Phil Knight’s memoir is a refreshingly honest take on what the path to business success looks lik… https://t.co/wSKVnpPjBO,billgates
12/7/2016 13:27,8.0649E+17,Tobacco use is the leading cause of preventable deaths. My friend @MikeBloomberg is working to change this. https://t.co/iLeAGjGwAv,billgates
12/6/2016 21:39,8.06252E+17,Looking for a book to enjoy over the holidays? Here are some of my favorites from 2016. https://t.co/SA3TXzXurk,billgates
12/6/2016 17:34,8.0619E+17,Anybody can learn to code. And everyone should give it a try: https://t.co/F0q0BRt8aR #HourOfCode,billgates
12/5/2016 18:22,8.0584E+17,Five of my favorite books of 2016: https://t.co/VIrgs6zQle https://t.co/b01iiO5UnK,billgates
12/4/2016 17:31,8.05465E+17,"This surprised me…wheat, rice, and corn all have more complex genomes than humans: https://t.co/bDIfSbRGwB https://t.co/j3nSd3ZNxm",billgates
12/2/2016 15:54,8.04715E+17,Toilet odors consist of over 200 chemical compounds. A perfume company isolated four culprits of the terrible smell… https://t.co/Peh2nCt9PJ,billgates
12/1/2016 21:30,8.04437E+17,Stories like this one aren’t told enough. We’re making incredible progress against neglected tropical diseases: https://t.co/h3hxPQKCx6,billgates
12/1/2016 16:42,8.04365E+17,I am inspired by South Africa’s youth who are working to address the HIV/AIDS epidemic: https://t.co/z3HBLZ3HKT… https://t.co/QZWLYO3COG,billgates
11/30/2016 23:33,8.04106E+17,Life-changing discoveries often get their start as government-funded research at a university:… https://t.co/kkyTqM31Rn,billgates
11/29/2016 20:35,8.03699E+17,I’m inspired by the generosity of so many people on #GivingTuesday. There’s still time to show your support today! https://t.co/dsGg3qcd47,billgates
11/29/2016 7:23,8.035E+17,Great leadership by PM @theresa_may. The UK is boosting its investment in research to accelerate innovation: https://t.co/s5OZyiyBqK,billgates
11/27/2016 16:44,8.02916E+17,We should all think about how new tools should and shouldn’t be used. This is especially true for genome editing:… https://t.co/Cv2EbW3EHk,billgates
11/24/2016 4:15,8.0164E+17,I’m often asked how a company can set itself apart and make an impact. Investing in R&amp;D is a great place to start:… https://t.co/W4pABKN3sR,billgates
11/23/2016 16:42,8.01466E+17,Our work is not possible without dedicated partners &amp; staff around the world. We are happy to accept the Medal of F… https://t.co/LkRjuCXvBY,billgates
11/23/2016 4:13,8.01278E+17,Melinda and I are deeply humbled to receive the Presidential Medal of Freedom for our foundation’s efforts to create a more equal world.,billgates
11/21/2016 20:40,8.00801E+17,Exciting progress… this new genetic chip could help bring the benefits of precision medicine to Africa. https://t.co/aIhKfcSOkx,billgates
11/19/2016 16:17,8.0001E+17,Stinky toilets are an obstacle to improving sanitation. This company is helping to solve this issue:… https://t.co/w3UczAfHd1,billgates
11/18/2016 22:36,7.99743E+17,Why do toilets smell so bad? I traveled to Switzerland to learn about the science of scent. https://t.co/GJT26hFVUh,billgates
11/18/2016 0:32,7.9941E+17,Why I like science: one remarkable discovery often leads to other scientific breakthroughs. https://t.co/sX5ts80kO4,billgates
11/17/2016 15:17,7.9927E+17,Pleasure meeting with @narendramodi. I’m optimistic about India’s future and its commitment to innovation. https://t.co/PGIjhpr1Ua,billgates
11/16/2016 20:33,7.98987E+17,"From poop water to poop perfume, I’m amazed by the innovation that’s underway in the field of sanitation:… https://t.co/3KPy4KGXbr",billgates
11/15/2016 20:36,7.98626E+17,"RT @gatesfoundation: India accounts for 70% of malaria cases in Southeast Asia, but it may get a breakthrough anti-malarial drug by 2018. h…",billgates
11/15/2016 15:44,7.98552E+17,.@DrSidMukherjee once again shows his gift for making science accessible. I'm glad I read his book:… https://t.co/jgsPH7Fxeq,billgates
11/14/2016 21:03,7.9827E+17,Gene editing is full of promise and peril. I discussed its future with “The Gene” author @DrSidMukherjee:… https://t.co/ywRKHlUQ9X,billgates
11/13/2016 17:28,7.97854E+17,A must-read piece. We need to inspire more innovation to meet our energy needs. https://t.co/fVQdcKuKns,billgates
11/7/2016 22:21,7.95753E+17,"Together, HIV and TB form a deadly duo. About one-third of people living with HIV are also infected with TB:… https://t.co/kNPLWw1NNR",billgates
11/6/2016 16:26,7.95301E+17,Everyday life looks remarkably similar for families across countries at the same income level:… https://t.co/910G9nyqkU,billgates
11/4/2016 15:06,7.94556E+17,"In 2016, global support for TB care and prevention fell $2 billion short of the $8.3 billion needed to fight it:… https://t.co/zJQNO8BEfk",billgates
11/2/2016 19:40,7.93901E+17,"Last year, Simbongile, a young mother, learned she was infected with TB. Her story is heartbreaking. https://t.co/5uRHpAFJ0M",billgates
11/1/2016 19:35,7.93537E+17,Tuberculosis is an often forgotten disease that I’m hoping can get the attention it deserves:… https://t.co/2Y8IN54VPc,billgates
10/31/2016 19:48,7.93178E+17,This morning I played in the first-ever online @BridgeWorldCup. I hope this draws more people to the card game I lo… https://t.co/4zMdx60Eaa,billgates
10/31/2016 14:15,7.93094E+17,Forget ghouls and goblins. These are the world’s scariest creatures: https://t.co/Ts3MaySyUS https://t.co/C21pnQHl7s,billgates
10/30/2016 16:13,7.92761E+17,"This is encouraging progress: since 2005, deaths from both HIV/AIDS and malaria have been reduced by 40%. https://t.co/oiWQsMYxNm",billgates
10/29/2016 15:02,7.92381E+17,"Science is the great giver. From penicillin to the Ebola vaccine, the world owes an ongoing debt to scientists:… https://t.co/o2MbwFs6nA",billgates
10/27/2016 13:49,7.91638E+17,This photo always makes me smile. #TBT https://t.co/fnw461sSuz,billgates
10/26/2016 23:23,7.9142E+17,A trip to London wouldn’t be complete without seeing my friend @richardbranson. We discussed the importance of the… https://t.co/P6Q5aH89q8,billgates
10/26/2016 0:20,7.91072E+17,We're closer than ever to ending polio thanks to new commitments from @MikeBloomberg and Ray Dalio:… https://t.co/6V4UMm03Rn,billgates
10/25/2016 18:46,7.90988E+17,RT @RiouxRemy: Very proud to partner with @BillGates and sign the first agreement between @AFD_en and @gatesfoundation ! #Health #Africa ht…,billgates
10/24/2016 7:48,7.9046E+17,"Progress is a powerful thing. Thanks to the hard work of millions, we’re closer than ever to eradicating polio.… https://t.co/5ezjnKoKQk",billgates
10/23/2016 13:44,7.90187E+17,Here’s why I believe investing in scientific research is critical to improving people’s lives:… https://t.co/dLX0IRmpIX,billgates
10/22/2016 23:21,7.8997E+17,These innovators are hoping to make a difference in the lives of others. They will be in Seattle for @SVPFastPitch. https://t.co/TmShWFXM7u,billgates
10/22/2016 14:02,7.89829E+17,"Long before The Cat in the Hat, Dr. Seuss was helping fight malaria. Learn how much progress the world has made:… https://t.co/hmZbaOymTD",billgates
10/21/2016 22:34,7.89596E+17,David Bunnell was one of the pioneers of the PC industry. I’m sad to learn of his death: https://t.co/eVb4zL43o5 https://t.co/TdLEZjoamh,billgates
10/21/2016 13:59,7.89466E+17,Great to be on campus at @Caltech yesterday. These students shared some bright ideas on how to power our future. https://t.co/jf4cq74axB,billgates
10/20/2016 18:36,7.89174E+17,Scientific discoveries aren’t just breathtaking insights into the nature of the universe. They fuel human progress:… https://t.co/XlgKt2H24y,billgates
10/20/2016 6:02,7.88984E+17,"Great news to report: More children will have the chance to live healthy, productive lives thanks to @UNICEF. https://t.co/dK5u5SLHx5",billgates
10/19/2016 13:52,7.88739E+17,"I sat down with my old friend David Rubenstein to discuss @microsoft, philanthropy and my hopes for the future: https://t.co/rHCAQSwj8O",billgates
10/18/2016 12:42,7.88359E+17,What I think our political leadership should do to accelerate innovation: invest in government R&amp;D. https://t.co/Y1uFJGUOd2,billgates
10/14/2016 16:56,7.86974E+17,".@POTUS, welcome to the club. https://t.co/XNN0pq68iQ",billgates
10/14/2016 14:32,7.86938E+17,"I’ve been in hospitals when malaria is at its peak. As a parent, these memories will stay with me for life:… https://t.co/IWKkoaulSR",billgates
10/13/2016 17:28,7.8662E+17,Precision maps are a powerful new tool in the fight against malaria: https://t.co/hipWG181CA via @NEJM and @IHME_UW,billgates
10/12/2016 16:49,7.86247E+17,What makes mosquitoes so deadly? I explore this question in my latest video... https://t.co/Q2n7oHLCtv,billgates
10/11/2016 13:36,7.85836E+17,What is the world’s deadliest animal? The answer might surprise you: https://t.co/OR6xVNjnkw https://t.co/DqVCGu6B8M,billgates
10/10/2016 20:28,7.85578E+17,The malaria death rate in sub-Saharan Africa has dropped by a stunning 57% since 2000. This progress is no accident… https://t.co/2LoLF82IDE,billgates
10/9/2016 14:05,7.85119E+17,What makes a great leader? I share my thoughts here: https://t.co/VKZCcpypbL https://t.co/J519TkC62I,billgates
10/7/2016 16:10,7.84426E+17,I’ve heard people argue that transformative innovations only come from the private sector. But you might be surpris… https://t.co/vwsk0FjpKa,billgates
10/6/2016 13:32,7.84024E+17,Here are four breakthroughs I believe we can accomplish over the next decade: https://t.co/f5iapcbuDj https://t.co/FycnFvev4O,billgates
10/4/2016 19:15,7.83385E+17,This chart makes me optimistic that we can end extreme poverty once and for all: https://t.co/D8dGvmkHok https://t.co/CMXvB1OKEb,billgates
9/30/2016 20:28,7.81954E+17,".@ErnestMoniz: By increasing support for energy R&amp;D, we can create new jobs and develop new technologies:… https://t.co/02FMtWQ4ya",billgates
9/30/2016 6:08,7.81737E+17,Life expectancy is one of the great stories in @MaxCRoser's Visual History of Global Health: https://t.co/sHBlWphEhW https://t.co/o7g4GiiBDl,billgates
9/28/2016 20:45,7.81233E+17,A historic achievement. The Americas region is the first in the world to be declared free of endemic measles. https://t.co/ivTuuXSiAl,billgates
9/28/2016 17:06,7.81178E+17,"When you come to South Africa, you can’t help but be filled with hope and optimism: https://t.co/mUKXWg8u0V https://t.co/vTUFUV3SV2",billgates
9/27/2016 14:40,7.80779E+17,"What has happened to global poverty over the last 20 years?
 
Check your answer here: https://t.co/d6GjGQJ1HV",billgates
9/25/2016 14:22,7.8005E+17,This is a huge milestone and a great sign that countries can work together to improve people’s lives: https://t.co/srxfs8YpwP,billgates
9/24/2016 14:35,7.79691E+17,How do you beat a virus? These former HIV researchers are now racing to find a cure for Zika. #longreads https://t.co/DuC8D9IBCT,billgates
9/23/2016 22:32,7.79448E+17,This is a headline we don’t see often enough… @NickKristof shares good news from the fight against extreme poverty. https://t.co/aGTB2Z8nZO,billgates
9/23/2016 13:56,7.79318E+17,What is the secret to American innovation? Two very important letters: https://t.co/sq8sV4QPTt https://t.co/Pq427ZfU1M,billgates
9/23/2016 4:58,7.79183E+17,Great article by PM of Norway @erna_solberg: “Polio anywhere poses a threat to all of us everywhere.” #UNGA… https://t.co/6IkvPoLVzZ,billgates
9/22/2016 20:53,7.79061E+17,I always feel humbled and inspired by my travels. I just wish others could come along: https://t.co/0KyaYT71mj https://t.co/KGULPrJGLn,billgates
9/21/2016 21:53,7.78714E+17,Investing in research is at the root of important innovations. Incredible news from the Chan Zuckerberg Initiative. https://t.co/flpFepRRK6,billgates
9/18/2016 1:29,7.77319E+17,"Canada, your support of @GlobalFund is so remarkable I just had to give @JustinTrudeau a hug. https://t.co/pOuPUjYN4i",billgates
9/15/2016 16:54,7.76464E+17,Travel with me (virtually) to South Africa and see how they are fighting HIV: https://t.co/d5NjjVDRGQ #VR https://t.co/vL9rCnOZhX,billgates
9/14/2016 18:22,7.76124E+17,Interesting. This student's invention could help save millions of lives: https://t.co/4poUGx2SWc https://t.co/s4rml3j0XC,billgates
9/13/2016 21:26,7.75808E+17,Africa is special to me. I recently returned to see its progress in the fight against AIDS: https://t.co/2ciUJ5QVX2 https://t.co/bQl6nd8eTj,billgates
9/10/2016 15:12,7.74627E+17,"One in every 200 people on Earth can’t see. But amazingly, a cure for blindness is now in sight. https://t.co/TU9zSwL1wQ",billgates
9/9/2016 14:50,7.74259E+17,Nate Bowling has a brilliant approach to making his subject matter relevant to his students: https://t.co/IdJEBYX8d9 https://t.co/CJq91azLwn,billgates
9/7/2016 16:37,7.73561E+17,These young innovators are driving astounding progress in their fields. https://t.co/6m8oAYPjvQ,billgates
9/6/2016 15:58,7.73189E+17,This imaging technique could make it easier for aid to reach the people who need it the most. https://t.co/iLuku6YAaS,billgates
9/4/2016 17:23,7.72485E+17,Safe drinking water is often a matter of life &amp; death. This organization's work brings it to those who need it most. https://t.co/P7Ep6F1Hxt,billgates
9/3/2016 14:46,7.72083E+17,Nate Bowling is committed to making his classroom a place his students want to be: https://t.co/20sc9fGXmN https://t.co/vqjuC46mc2,billgates
9/2/2016 5:05,7.71575E+17,TB is one of the world’s most devastating diseases. India is crucial to the global fight. https://t.co/bXIzO1ANgk https://t.co/MvobWtldEL,billgates
9/1/2016 21:45,7.71464E+17,Very few people thought we would ever eradicate smallpox. The great D.A. Henderson was one of them. https://t.co/gfNZVmMKZ2,billgates
8/31/2016 20:13,7.71078E+17,Melinda explains why gender diversity helps create better companies and better products: https://t.co/d3V0mgMw7w https://t.co/MUi33E1dl6,billgates
8/30/2016 14:18,7.70627E+17,"Happy Birthday, Warren. Everyone should be lucky enough to have a friend like you. https://t.co/QPHyln6AwI",billgates
8/29/2016 17:51,7.70318E+17,"Nate Bowling uses Star Wars to help his students understand the civil rights movement. It’s pretty amazing stuff…
https://t.co/bBgS0QpGKq",billgates
8/26/2016 22:24,7.69299E+17,.@DonorsChoose Incredible! Thanks to everyone for helping teachers start the school year off right.,billgates
8/26/2016 14:22,7.69178E+17,“Never underestimate the power of nerddom.” @nate_bowling is proud to call himself a nerd: https://t.co/5sPg55u8Vy https://t.co/8HGUt7O0US,billgates
8/25/2016 14:02,7.68811E+17,Find a @DonorsChoose project that inspires you and we’ll double your donation. https://t.co/Tq51LSKmD2 https://t.co/iAltkuQbNC,billgates
8/24/2016 21:13,7.68557E+17,"Personalized learning represents a big shift for students and teachers. The results so far are promising.
https://t.co/mHf5MNn0qm",billgates
