Datetime,Tweet Id,Text,User
9/21/2019 12:23,1.17538E+18,"I am hopeful that we can substantially alter the course of Alzheimer’s disease. This World Alzheimer’s Day, join me… https://t.co/00Em1RetgG",billgates
9/20/2019 19:45,1.17513E+18,The docuseries about my life and work is out today. I hope you’ll check it out on @netflix — and then read some of… https://t.co/Z3AJvdukhw,billgates
9/20/2019 11:53,1.17501E+18,Adapting to climate change requires support from governments and businesses to ensure those most at risk have the o… https://t.co/wA7SJcgkRr,billgates
9/19/2019 23:38,1.17483E+18,The new docuseries that looks at my work is out tomorrow. I hope you check it out on @netflix. I can’t wait to hear… https://t.co/7sQck1yy3X,billgates
9/19/2019 16:27,1.17472E+18,"As governments invest more in primary health care systems, overall health outcomes improve. Here’s how:… https://t.co/PAQuourGXa",billgates
9/18/2019 18:13,1.17439E+18,Melinda and I started out ahead. But hundreds of millions of people around the world have to overcome hurdle after… https://t.co/0mhCkpjSof,billgates
9/17/2019 21:57,1.17408E+18,Health and education are improving everywhere in the world. But the gap between countries’ progress can be enormous… https://t.co/QDp81vaLMv,billgates
9/12/2019 16:07,1.17218E+18,The Lasker-Bloomberg Public Service Award is a well-deserved recognition of @gavi's life-saving work. Congratulatio… https://t.co/5gxMmN0HRv,billgates
9/10/2019 17:51,1.17148E+18,"Congratulations @BradSmi and @CarolAnnBrowne! Your insights have never been more relevant, and I am glad others wil… https://t.co/ZbLg0ECuYf",billgates
9/7/2019 12:00,1.17031E+18,"Today, it’s difficult for researchers to diagnose #Alzheimers patients early enough to intervene. A reliable, easy… https://t.co/uYqtjWZEav",billgates
9/7/2019 1:29,1.17015E+18,Here’s a remarkable statistic: Nearly 1.1 billion fewer people are living in extreme poverty today than in 1990.  B… https://t.co/f9vpmYNYXC,billgates
9/4/2019 16:39,1.16929E+18,The fact that a quarter of the kids born on the planet don’t get the right food to develop is a mind-blowing traged… https://t.co/FRuCNA0qV5,billgates
9/1/2019 12:00,1.16813E+18,"Climate change is one of the toughest challenges facing the world. But don’t despair…

Scientists and entrepreneurs… https://t.co/eOXr1S97hr",billgates
8/31/2019 17:05,1.16785E+18,Manufacturing steel is one of the largest sources of greenhouse gas emissions. Boston Metal is working to change th… https://t.co/Xf9uzGmZnY,billgates
8/30/2019 11:54,1.16741E+18,"Tuberculosis is still the leading infectious cause of death worldwide. To #EndTB, we need to continue to develop sa… https://t.co/KnOwQmn5fi",billgates
8/27/2019 18:59,1.16642E+18,"Whenever I hear an idea for what we can do to keep global warming in check, I always ask this question: “What’s you… https://t.co/68GxhslFhN",billgates
8/27/2019 8:06,1.16626E+18,"Germany, Italy, and the European Commission have demonstrated great leadership with their commitments to the… https://t.co/JXmHiW8ypO",billgates
8/26/2019 21:35,1.1661E+18,"When I think about the world I want for my children, I know that #EqualityCantWait. When women and men can reach th… https://t.co/o93xxXaNlt",billgates
8/23/2019 21:29,1.16501E+18,"Canada’s $930 million commitment to the @GlobalFund is a big step towards saving millions of lives. Their pledge, a… https://t.co/nVgzlrU5Wa",billgates
8/22/2019 12:00,1.16451E+18,"If we want to give our kids the best chance possible to succeed after high school, we need more teachers like… https://t.co/YNxA4ZyUgm",billgates
8/21/2019 17:14,1.16422E+18,Today marks three years since Nigeria's last wild poliovirus case. This progress wouldn’t have been possible withou… https://t.co/syaeFcPLJd,billgates
8/20/2019 3:04,1.16365E+18,"Tomorrow is #WorldMosquitoDay, when we recognize all of our partners and grantees who are fighting against the worl… https://t.co/Gtqs9x2k2l",billgates
8/17/2019 14:13,1.16273E+18,"I never really learned how to cook. I’m finally learning my way around the kitchen, though, thanks to Robert Hand:… https://t.co/pOpW7x5tAX",billgates
8/14/2019 20:13,1.16173E+18,Four billion people are at risk from mosquito-borne diseases. We can get that number down to zero if we invest in n… https://t.co/a0CAhBgYR0,billgates
8/14/2019 11:48,1.16161E+18,I learned a lot from Washington State Teacher of the Year @_MrHand about creating a classroom where kids want to be… https://t.co/RwtyMoqq2X,billgates
8/13/2019 14:32,1.16128E+18,"Melinda and I are big fans of @DonorsChoose, and we were thrilled to learn that @WKamauBell is, too. Today, when yo… https://t.co/hisHofhp9l",billgates
8/13/2019 11:30,1.16124E+18,"When teachers have the right tools, there’s no telling where it will take them. Today, when you give to… https://t.co/mOzBeKVxxC",billgates
8/10/2019 15:33,1.16021E+18,Being poor isn’t cheap. It’s hundreds of times more expensive to use charging stations than it is to charge a phone… https://t.co/5Wz2O0KWgi,billgates
8/9/2019 14:20,1.15983E+18,"Whenever I want to understand something better, I pick up a book. Here are some of the best ones I’ve read so far t… https://t.co/Gm0HnyPieW",billgates
8/7/2019 16:57,1.15915E+18,There is no question that reliable electricity unlocks a better life for people. But can we power the world without… https://t.co/TX89IYK8ar,billgates
8/5/2019 17:48,1.15843E+18,"Think back to the last time you experienced a power outage. If you live in New York, you don’t have to think that f… https://t.co/BgezIPxLR3",billgates
8/1/2019 17:21,1.15698E+18,"Five years ago, India was declared polio-free. This incredible milestone was made possible by the health workers, g… https://t.co/xQTPqO8JXj",billgates
7/29/2019 18:42,1.15591E+18,"What if we really are all in this together? In this fascinating book, @NAChristakis explains why and how humans evo… https://t.co/1GI9BvvZsq",billgates
7/29/2019 15:00,1.15586E+18,10 breakthrough technologies that could help us feed the world and fight climate change at the same time. https://t.co/u8zStX4iwQ,billgates
7/29/2019 0:00,1.15563E+18,It's hard to overstate how important finding a better diagnostic is for fighting #Alzheimers. That’s why I’m invest… https://t.co/47n6kC3jfD,billgates
7/26/2019 16:18,1.15479E+18,"If you read one article about climate change this week, check out this one from @voxdotcom. Government support for… https://t.co/mun7s4P1Dw",billgates
7/23/2019 20:23,1.15376E+18,Are our similarities powerful enough to overcome our differences? “Blueprint” is an optimistic (and terrific) book… https://t.co/jgaVOfk40Y,billgates
7/21/2019 23:52,1.15309E+18,"I usually wait until the end of the year to share good news that you might have missed, but I couldn’t resist shari… https://t.co/QpyZG38Y2F",billgates
7/20/2019 12:00,1.15255E+18,Can you imagine an aircraft engine in your car? The @ARPAE Summit is one of the coolest places to learn about new e… https://t.co/dYPOUnFNfl,billgates
7/19/2019 21:58,1.15234E+18,The people who will suffer most from climate change are the ones least responsible for it. Here’s how we can help t… https://t.co/GyRTbQ3PPG,billgates
7/18/2019 16:33,1.15189E+18,This is something I would have loved as a kid: @MicrosoftStore is hosting a series of free Camp Know Where events a… https://t.co/umTr600RP8,billgates
7/18/2019 11:18,1.15181E+18,"What political and economic changes are needed to address climate change? If you’re between 16 and 25 years old, sh… https://t.co/DarRwwvtq1",billgates
7/17/2019 22:47,1.15162E+18,Last year @GatesUS invested $92 million in networks of schools that are working together to improve student outcome… https://t.co/UKhK7z6QKj,billgates
7/15/2019 3:18,1.15061E+18,I recently wrote about how people with tech skills can find fascinating problems to work on in global health and de… https://t.co/ANi6qJVDeH,billgates
7/12/2019 16:51,1.14972E+18,"“Fathers who help unlock their daughter’s potential, standing up for their rights and raising them to believe they… https://t.co/E88mw95ZpS",billgates
7/11/2019 22:31,1.14945E+18,"Nearly one billion malaria cases have been prevented since 2000, but infection rates have plateaued or even increas… https://t.co/QNhIsALyIh",billgates
7/9/2019 19:26,1.14867E+18,Can we feed 10 billion people? I’m optimistic that we can if we invest in research that will help poor farmers adap… https://t.co/JG9t0gO5cY,billgates
7/3/2019 23:20,1.14656E+18,Nuclear power is the second-largest source of low-carbon electricity in the world — but its growth is slowing down.… https://t.co/aHzLvYqtr2,billgates
7/3/2019 17:21,1.14647E+18,I wish I had understood much earlier in my career what true inequity looks like and how to fight it. That’s why I’m… https://t.co/vMbA96MYxU,billgates
7/1/2019 14:10,1.1457E+18,This is the teletype that brought Paul Allen and me together. And I’m so glad that it did. Paul was one of the most… https://t.co/i6g0BMFr9N,billgates
6/30/2019 16:21,1.14537E+18,More people are getting their electricity from renewable sources that ever before. Here’s how we can build on the p… https://t.co/bvm0sP7Ebe,billgates
6/29/2019 15:46,1.145E+18,"Today’s commitment by @theresa_may to #StepUpTheFight against AIDS, TB and malaria will help save millions of lives… https://t.co/7LNj3JX7kI",billgates
6/28/2019 17:14,1.14466E+18,My friendship with Paul Allen changed my life. I loved sharing some of my favorite stories about him (and a few old… https://t.co/BvQIBm38iB,billgates
6/27/2019 11:57,1.14421E+18,Few inventions have changed our lives as much as the battery. I’m excited that more inventors and investors are bei… https://t.co/pVBxzFTJAJ,billgates
6/27/2019 0:00,1.14403E+18,It’s great to see such early support from Japan in re-committing to the @GlobalFund. The support of @AbeShinzo and… https://t.co/fGwXtkVNkJ,billgates
6/25/2019 12:05,1.14349E+18,"I’m excited about the progress we’re making toward understanding Alzheimer’s. For the first time, @MIT researchers… https://t.co/lWLXkJiqcb",billgates
6/24/2019 12:51,1.14314E+18,"I love talking about toilets. @NatGeo recently wrote about two that I think could change the world.
https://t.co/2Q521aLrDK",billgates
6/22/2019 4:45,1.14229E+18,I’m excited to see such incredible leadership from @EmmanuelMacron and the people of France towards @GlobalFund. If… https://t.co/1yIDluZcfF,billgates
6/20/2019 16:22,1.14174E+18,I learned what’s possible in agriculture from studying a remarkable scientist named Norman Borlaug. If you’re curio… https://t.co/IWBkbwBxpB,billgates
6/19/2019 16:57,1.14139E+18,"If you have the willingness to learn about a problem and the talent to help solve it, you can make a remarkable dif… https://t.co/4URUTuqcil",billgates
6/18/2019 18:08,1.14105E+18,"I encourage software developers, inventors, and scientists to consider how they can use their skills to fight inequ… https://t.co/0P2l9ThfOi",billgates
6/17/2019 17:39,1.14068E+18,"When @goodreads asked me to share my top summer reading recommendations, it was hard to narrow down the list. https://t.co/SlVDDIDnd7",billgates
6/15/2019 15:07,1.13991E+18,Fighting disease is like fighting fire. It’s not enough to put out most of it — you have to get it all. @Rotary’s g… https://t.co/Zio9nWxsUi,billgates
6/14/2019 16:33,1.13957E+18,The fight against malaria is one of the greatest success stories in global health — but progress has slowed in rece… https://t.co/BMtUZu6QTn,billgates
6/13/2019 16:16,1.1392E+18,"I was moved by this story: Bob’s daughter has Down syndrome, which puts her at a higher risk for dementia. Motivate… https://t.co/UbTDVcDZWQ",billgates
6/12/2019 16:34,1.13885E+18,Our foundation’s Day of Caring is one of my dad’s favorite days of the year. I know he can’t wait to hear what our… https://t.co/s81X5MgeAD,billgates
6/11/2019 18:58,1.13852E+18,I’m always amazed by the disconnect between what we see in the news and the reality of the world around us. As my l… https://t.co/F6OwugM850,billgates
6/8/2019 17:49,1.13742E+18,"Thank you for being a friend, Warren: https://t.co/4hhwUvkGox #BestFriendsDay https://t.co/1hmF1WE5gC",billgates
6/8/2019 14:56,1.13737E+18,I’m thrilled about the elimination of malaria from Algeria and Argentina. This news gives me hope that we’ll one da… https://t.co/m4oWhAVbzH,billgates
6/7/2019 16:26,1.13703E+18,"David Letterman’s newest season of #MyNextGuest has a lot of fascinating guests, but there’s one clear standout for… https://t.co/1GmkRjkJx9",billgates
6/5/2019 14:06,1.13627E+18,Patience: it's a valuable skill for investing and for training new employees at Dairy Queen. https://t.co/654kxGktaO,billgates
6/4/2019 12:07,1.13588E+18,Warren and I recently picked up a @DairyQueen shift. I think I may have been a quicker study in the Blizzard depart… https://t.co/9v7Pfyscxe,billgates
6/3/2019 4:20,1.1354E+18,A powerful call to action from @angienguku on the eve of #WD2019. @melindagates and I are impatient for every mothe… https://t.co/0x1RJk2E5D,billgates
5/31/2019 16:52,1.1345E+18,"If you’re working on digital biomarkers for Alzheimer's disease and related dementias, I encourage you to apply for… https://t.co/HgILGvvgDd",billgates
5/31/2019 16:49,1.1345E+18,Congratulations to the first round of award recipients from @TheADDF’s Diagnostics Accelerator. Your ideas are gett… https://t.co/nAUWkUUpd5,billgates
5/30/2019 16:22,1.13413E+18,Identifying candidates for clinical trials more quickly is essential in the fight against Alzheimer’s. That’s why I… https://t.co/IinZ9zQ1KB,billgates
5/29/2019 17:26,1.13379E+18,"I recently sat down with one of my favorite authors, Jared Diamond. His perspective on political polarization reall… https://t.co/7V2lrpkhm9",billgates
5/28/2019 19:14,1.13345E+18,Breakthrough Energy Ventures – Europe will be a catalyst for innovative solutions to fight climate change. We have… https://t.co/hvdDw3DW3m,billgates
5/28/2019 16:26,1.13341E+18,"We need the collective effort of governments, individuals, and the private sector to tackle climate change. I’m exc… https://t.co/apqvhzQZZ9",billgates
5/25/2019 14:07,1.13229E+18,I can’t recommend these books highly enough: https://t.co/h9J71vWAcz https://t.co/3gOdcA4OaX,billgates
5/24/2019 17:38,1.13198E+18,"Last year I recommended “Bad Blood,” which is about the rise and fall of Theranos. This year I’m recommending “Nine… https://t.co/BXNxYzx70S",billgates
5/24/2019 14:30,1.13193E+18,Congratulations @NarendraModi on a remarkable win in #IndianElections2019. Your continued commitment to improve hea… https://t.co/5ylNvZXOpn,billgates
5/23/2019 12:00,1.13153E+18,"I’m a big fan of everything Jared Diamond has written, and his latest book, “Upheaval,” is no exception. You can do… https://t.co/91I0F5Tcur",billgates
5/22/2019 20:31,1.1313E+18,"This #RedNoseDay, I’m swapping out my usual summer books for something a little different. Learn how you can help e… https://t.co/h0w9I6C890",billgates
5/21/2019 16:42,1.13088E+18,"Whether you’re a political leader or just an armchair historian, you’ll learn a lot from @BeschlossDC's book “Presi… https://t.co/wdl4Roovad",billgates
5/20/2019 22:59,1.13061E+18,This book will take you on a trip you’ll never forget: https://t.co/l4IvTS9AHD https://t.co/mNkg6G9lof,billgates
5/20/2019 17:47,1.13053E+18,Looking for a summer read? You can’t go wrong with one of these great books: https://t.co/xB82XMnJY9,billgates
5/20/2019 0:43,1.13027E+18,"This is great news: wind and solar power generation is expanding at record rates, allowing more people to get their… https://t.co/Gp976XiPiE",billgates
5/19/2019 12:21,1.13009E+18,"Together, we can achieve what @Rotary first envisioned: a world where no child will be struck with polio ever again… https://t.co/rRoWJGvCco",billgates
5/17/2019 14:47,1.1294E+18,Nearly every job created since the last recession has gone to someone with a post-high school education. But which… https://t.co/uz6GUviXiQ,billgates
5/16/2019 19:21,1.1291E+18,"A college degree is the surest path to a healthy, rewarding life and career. But which degrees and programs provide… https://t.co/4TDvrYiXTo",billgates
5/15/2019 21:12,1.12877E+18,Everyone at the @gatesfoundation looks forward to days when our trustee Warren is on campus. @melindagates and I co… https://t.co/HONCGF2FBm,billgates
5/15/2019 18:20,1.12873E+18,It is surprisingly hard to store renewable energy. Here are three startups I’m excited about that are tackling this… https://t.co/vMdkkX3VqI,billgates
5/15/2019 0:08,1.12845E+18,It’s easy to be overwhelmed by climate change and what to do about it. I recently wrote about why I’m optimistic we… https://t.co/eCdEevDcYi,billgates
5/13/2019 16:08,1.12797E+18,"A fascinating discussion with computer scientist @drfeifei, historian @harari_yuval, and journalist @nxthompson on… https://t.co/6ESu0FY2gr",billgates
5/12/2019 22:09,1.1277E+18,"My mom was one of the most generous people I’ve ever known. If I grew up #WithoutMom, I wouldn’t be the man I am to… https://t.co/T3j1O0ew6P",billgates
5/12/2019 14:52,1.12759E+18,All my life I’ve been surrounded by remarkable women. And I was moved when Melinda decided to write about two of th… https://t.co/2V6tXgdaNW,billgates
5/11/2019 17:31,1.12726E+18,This fascinating #dataviz looks at how the global population pyramid is changing. With the right investments in hea… https://t.co/7DipZ0ML8S,billgates
5/10/2019 2:56,1.12668E+18,I was touched when Melinda asked me to introduce her at her #MomentofLift book tour stop in Seattle tonight. I want… https://t.co/FyAZWcinnV,billgates
5/9/2019 16:33,1.12653E+18,2018 National Teacher of the Year @MandyRheaWrites told me about the remarkable resilience of her students. I was i… https://t.co/1rXKoqOAE4,billgates
5/8/2019 14:29,1.12613E+18,I really enjoyed spending time with 2017 WA State Teacher of the Year @farmtableteach. She showed me a neat lesson… https://t.co/HKcPtOifwd,billgates
5/7/2019 21:45,1.12588E+18,"For Teacher Appreciation Week, I’ll be highlighting some of the most impactful lessons I’ve learned from educators… https://t.co/PyrDhqvtMB",billgates
5/7/2019 21:24,1.12587E+18,"RT @GatesUS: No one has more insight than teachers into what makes a classroom tick, or how to reach &amp; inspire a struggling student. 

Happ…",billgates
5/6/2019 18:34,1.12547E+18,I’ve learned a lot from the career of this real-life Sherlock Holmes: https://t.co/LhCRp52KgN https://t.co/0GnuegjFep,billgates
5/4/2019 19:43,1.12476E+18,Melinda and I love meeting with people who are trying to change the world. Here are four of the people who inspired… https://t.co/MrmYszRNMG,billgates
5/3/2019 13:50,1.12431E+18,What does a “dirt detective” do for a living? I’m eager to watch this talk from soil scientist Asmeret Asefaw Berhe… https://t.co/Rw3GrZ1V3q,billgates
5/2/2019 21:58,1.12407E+18,"A few months ago, Fred contributed a piece to my blog which outlined why educating the next generation of African l… https://t.co/jPqGy5OhR3",billgates
5/2/2019 21:58,1.12407E+18,"By the end of the century, almost half of the young people in the world will be in sub-Saharan Africa. https://t.co/ZiBfAgjpxx",billgates
5/2/2019 21:58,1.12407E+18,.@FredSwaniker has an ambitious plan to unlock the talents of young Africans. I was thrilled to see him featured in… https://t.co/M411GHFCxL,billgates
5/2/2019 15:47,1.12398E+18,It’s hard for me to overstate how brave people who fight outbreaks are. They face a near-impossible task with grace… https://t.co/C5HYQuTOlR,billgates
5/1/2019 23:08,1.12373E+18,Congratulations @SueDHellmann on your 5th anniversary @gatesfoundation. Your leadership on some of the world’s toug… https://t.co/oNvoClCO3i,billgates
5/1/2019 16:30,1.12363E+18,The world’s historic progress to #endpolio would not be possible without the strong commitment of partners like… https://t.co/pCePwNoI0U,billgates
4/30/2019 16:31,1.12326E+18,"If you enjoyed the @Avengers this weekend, I think you’ll be inspired by these real-life heroes:… https://t.co/UISSYrSC1a",billgates
4/30/2019 1:28,1.12304E+18,"It’s amazing to think about the creative ways we’ve delivered vaccines over the years (even by dog sled, when neces… https://t.co/im8i1Ujhel",billgates
4/28/2019 16:10,1.12253E+18,The promise and perils of gene-editing might be the most important public debate we haven’t been having widely enou… https://t.co/e1LcPvW28E,billgates
4/26/2019 13:48,1.12177E+18,"One of my favorite authors, @sapinker, co-wrote a piece about why nuclear power is so important in fighting climate… https://t.co/pKWclbfZcA",billgates
4/25/2019 13:52,1.12141E+18,Deaths from malaria have dropped 42% since 2000. I’m as optimistic as ever that we can get to zero deaths in our ge… https://t.co/tiimK3witk,billgates
4/24/2019 11:54,1.12102E+18,Stories like this one from Kenya remind me of why Melinda and I started our foundation. I'm optimistic we will cont… https://t.co/XAm4jQgsVA,billgates
4/23/2019 14:04,1.12069E+18,"Melinda’s new book, The #MomentofLift, is out today: https://t.co/sC4eE1Jy8N.

She combines her mastery of data wit… https://t.co/Gbz9r4Ts8U",billgates
4/22/2019 14:25,1.12033E+18,"On #EarthDay, I’m inspired by the inventors who are tackling climate change and all the people who are supporting t… https://t.co/bw0imff81U",billgates
4/20/2019 18:55,1.11968E+18,Melinda’s new book The #MomentofLift is an urgent call to action. I’ll commit to the lift by working to ensure that… https://t.co/RW2elIYTC5,billgates
4/20/2019 15:40,1.11963E+18,Gene drive is a technique where you give a few mosquitoes an edited gene and it drives itself into all their offspr… https://t.co/DODBKVfYRE,billgates
4/19/2019 21:00,1.11934E+18,"Less than a century ago, families everywhere lived in fear of a mosquito bite. Now 75% of all malaria cases occur i… https://t.co/3UlIb4iuwe",billgates
4/19/2019 14:22,1.11924E+18,3: Which of the following factors affect the spread of malaria? The answer is in my latest blog post: https://t.co/Vv1rQ79zSJ,billgates
4/19/2019 14:22,1.11924E+18,2: What kind of pathogen causes malaria? Find the answer here: https://t.co/tUPDUDpfK7,billgates
4/19/2019 14:22,1.11924E+18,"Biology pop quiz! Test your knowledge about the world’s deadliest animal: the mosquito.

1: Of the 3,000 species of… https://t.co/VkHLU3bRUa",billgates
4/18/2019 14:17,1.11888E+18,"Here’s one reason why I really, really hate mosquitoes: https://t.co/DDG0kG692T #MosquitoWeek https://t.co/7qTfCLDKmu",billgates
4/18/2019 0:17,1.11867E+18,"I’ve been fascinated by Leonardo da Vinci for decades. Although he died 500 years ago, there’s still so much to lea… https://t.co/kWp8kF3uij",billgates
4/17/2019 13:53,1.11851E+18,Precision maps are bringing us closer to the day when malaria is gone forever. https://t.co/mxqN60hOJN,billgates
4/16/2019 16:57,1.1182E+18,Why I would rather encounter a shark in the wild than a mosquito: https://t.co/6CrnkJ6f31 #MosquitoWeek https://t.co/uB5YFPLgzO,billgates
4/16/2019 14:18,1.11816E+18,I’m proud that @Microsoft is one of the many companies taking action to fight climate change and excited about its… https://t.co/PY3rkpaZLV,billgates
4/15/2019 17:18,1.11784E+18,"To kick off #MosquitoWeek, I wrote about the world’s deadliest shapeshifter (and what scientists are learning about… https://t.co/pDEJiwDU6H",billgates
4/15/2019 17:18,1.11784E+18,"Shapeshifters are not just the stuff of science fiction, though. We have them right here on earth.",billgates
4/15/2019 17:18,1.11784E+18,There’s an epic scene at the end where Spock has to figure out which one is the impostor. https://t.co/yOSI4WyneG,billgates
4/15/2019 17:18,1.11784E+18,"As a teenager, I remember watching an episode of the original Star Trek where the bad guy is a shapeshifter who tur… https://t.co/MDkPCMhDuC",billgates
4/15/2019 17:18,1.11784E+18,"When I was younger, I loved science fiction. The author I read the most was Robert Heinlein (“The Moon Is a Harsh Mistress” was a favorite).",billgates
4/14/2019 20:48,1.11753E+18,They're back... #MosquitoWeek https://t.co/4vt2Vt3fGN,billgates
4/14/2019 16:35,1.11747E+18,Young Africans will shape the future of not just their own communities but the entire world. https://t.co/8h83nylCgw,billgates
4/12/2019 22:13,1.11683E+18,Melinda and I were honored to join President Bush and Laura Bush @TheBushCenter. Their leadership of programs like… https://t.co/BQP0lGr8yo,billgates
4/12/2019 13:53,1.1167E+18,I would say this even if I weren’t married to the author: @melindagates’s new book “The Moment of Lift” is a terrif… https://t.co/A0R5jBCodI,billgates
4/10/2019 12:04,1.11595E+18,I’ve learned so much from Melinda over the years and I’m delighted she is now sharing her insights with the rest of… https://t.co/LwZ6b7ZUQT,billgates
4/9/2019 17:15,1.11566E+18,"I’ve recommended a lot of books over the years, but The #MomentofLift is particularly special to me… https://t.co/E2ZbzXSCU5",billgates
4/9/2019 17:15,1.11566E+18,"It also includes insights about our marriage, the path we took to become equals in our work, and how she has helped… https://t.co/bPl1yUUzM1",billgates
4/9/2019 17:15,1.11566E+18,She shares her personal journey from private citizen to public advocate -- including how she pushed our foundation… https://t.co/AHLBpyDXCk,billgates
4/9/2019 17:15,1.11566E+18,"“The Moment of Lift” is a wise, honest, and beautifully written book about how empowering women lifts up everyone.",billgates
