Datetime,Tweet Id,Text,User
6/24/2018 15:04,1.0109E+18,"More than 25 years later, Warren and I have never run out of things to laugh about: https://t.co/YptnliWmOu https://t.co/9uNUdOjJgO",billgates
6/23/2018 15:04,1.01054E+18,"If you’re interested in donating your time or resources but don’t know where to start, @TheEconomist recently highl… https://t.co/jo18xSncsm",billgates
6/21/2018 19:20,1.00988E+18,"Earlier this month, the world lost one of the greatest vaccine creators of our time. Dr. Adel Mahmoud saved the liv… https://t.co/n5HqhxDuRz",billgates
6/21/2018 3:34,1.00964E+18,"Tomorrow is the longest day of the year. While this is a cause for celebration for most of us, that may not be the… https://t.co/ClKuPWVyR9",billgates
6/19/2018 18:01,1.00913E+18,My friend @WarrenBuffett plays a mean pinball. https://t.co/GLaGn8tCf6,billgates
6/18/2018 12:44,1.00869E+18,Keeping vaccines cold when you’re delivering them to the most remote places on earth is a tough challenge. I asked… https://t.co/wa1Uewfx8a,billgates
6/15/2018 13:17,1.00761E+18,I’m excited about a revolutionary invention that’s already helping more kids get vaccinated:… https://t.co/aWwA3KTZAJ,billgates
6/14/2018 13:24,1.00725E+18,"Collaboration is key to our work at the foundation. @hbuffett's new book ""Social Value Investing"" explores how to m… https://t.co/IUT46k2sjw",billgates
6/13/2018 17:48,1.00696E+18,Two of the things I love most about my job are getting to see amazing innovations and talk to remarkable people. On… https://t.co/DKZerTnZTE,billgates
6/12/2018 14:18,1.00654E+18,World-class engineers and artists are working together to design bionic limbs for children with disabilities:… https://t.co/MSKtFlQGbl,billgates
6/11/2018 17:31,1.00623E+18,I recently visited an incredible non-profit called @Limbitless3D that is working to change the way the world thinks… https://t.co/IQseRZXKb6,billgates
6/9/2018 14:24,1.00546E+18,"“Progress is not a matter of faith or optimism, but is a fact of human history, indeed the greatest fact in human h… https://t.co/3HaRkEoWhI",billgates
6/7/2018 19:42,1.00481E+18,"I consider myself lucky to call Seattle home, and am thrilled that one of Seattle’s favorite local bands @PearlJam… https://t.co/Lt70XnSYeI",billgates
6/7/2018 12:00,1.00469E+18,"If you’re getting a degree from a U.S. college this spring, I have a present for you. Download a free copy of one o… https://t.co/afVbfRsneL",billgates
6/6/2018 14:02,1.00436E+18,I’m thrilled that the Giving Pledge is becoming truly global. Melinda and I are pleased to welcome the addition of… https://t.co/nyP3ZIWILz,billgates
6/5/2018 14:58,1.00401E+18,"My wish for you at this special time is to learn to think, and act, factfully. Congratulations, and good luck!",billgates
6/5/2018 14:57,1.00401E+18,"“When we have a fact-based worldview,” he writes, “we can see that the world is not as bad as it seems—and we can s… https://t.co/nH6qkSEoUd",billgates
6/5/2018 14:56,1.00401E+18,I hope you enjoy “Factfulness” as much as I did. And I hope you take Hans’s advice to heart.,billgates
6/5/2018 14:55,1.00401E+18,"Dear Class of 2018: Congratulations! To prepare you for the opportunities and challenges that lie ahead, I have a g… https://t.co/1DvQOqd4w6",billgates
6/1/2018 14:05,1.00255E+18,"Dr. @denismukwege has witnessed unimaginable human suffering, and yet is one of the most optimistic people I’ve eve… https://t.co/EHNeAJbGuy",billgates
6/1/2018 4:35,1.00241E+18,Congratulations to @AminaJMohammed and @UN for the adoption today of bold new reforms. I look forward to continuing… https://t.co/Y5Ak1biyMg,billgates
5/31/2018 16:51,1.00223E+18,I thought I knew pretty much everything there was to know about Abraham Lincoln. But I recently read a book that su… https://t.co/G6AhvE53K2,billgates
5/30/2018 20:29,1.00192E+18,"I will never forget meeting @DenisMukwege. He and his staff have helped more than 50,000 survivors of sexual violen… https://t.co/nsurnn6u4k",billgates
5/30/2018 2:12,1.00165E+18,Looking forward to being back in Beijing for the New Economy Forum with @MikeBloomberg. I’m excited to explore how… https://t.co/rBHcbD9IZ3,billgates
5/29/2018 13:43,1.00146E+18,".@BigHistoryPro is my favorite course of all time. Its creator, @davidgchristian, has condensed the big history sto… https://t.co/Mc0IvVklUs",billgates
5/26/2018 16:00,1.00041E+18,“Any commencement speaker can encourage young people to live up to their potential. But these graduates deserve mor… https://t.co/KpuOAsXrAE,billgates
5/25/2018 14:00,1.00001E+18,"I’m fortunate to own one of the 32 surviving journals of Leonardo da Vinci, so I was eager to read @WalterIsaacson’… https://t.co/DvozkzWVq4",billgates
5/24/2018 20:00,9.99742E+17,"Progress is sometimes hard to see…but when you look at the facts, things are looking up: https://t.co/oHsL1UQESR https://t.co/jXSag5KcJn",billgates
5/24/2018 12:00,9.99621E+17,We’re teaming up with #RedNoseDay to fight child poverty. Learn how you can get involved at https://t.co/2jM0MFUIp8 https://t.co/fnkMQQmwHD,billgates
5/23/2018 13:32,9.99282E+17,".@KatecBowler’s memoir belongs on the shelf alongside other great books about mortality, like “When Breath Becomes… https://t.co/n4Qm62SNfG",billgates
5/22/2018 15:01,9.98942E+17,"I’ve read some terrific books lately. Here are a few you might want to try this summer. Also, puppies… (CC… https://t.co/BwQoXjs4P8",billgates
5/21/2018 15:58,9.98594E+17,"From Lincoln to Leonardo, I hope you enjoy my summer reading list. https://t.co/fRrg5HwzoG",billgates
5/17/2018 17:35,9.97169E+17,"At @MDCollege, smarter advising is helping students go further faster. https://t.co/iWuEG8Bj2K",billgates
5/17/2018 12:00,9.97084E+17,Glad to see this story told. I’m always inspired by the local leaders and health workers involved in the fight to… https://t.co/TCztFxNOww,billgates
5/16/2018 21:20,9.96863E+17,"In the early days of Microsoft, I felt pretty confident about my coding skills, but I had a lot to learn about mana… https://t.co/3q97vzFGE4",billgates
5/16/2018 16:46,9.96794E+17,"France has been a leading champion in the fight against HIV/AIDS, TB, and malaria.  Their generosity has helped us… https://t.co/rECgasjmld",billgates
5/16/2018 12:21,9.96727E+17,I recently caught a glimpse at the future of higher ed: https://t.co/42muSNzC4V https://t.co/nZRklHEJvH,billgates
5/15/2018 12:00,9.9636E+17,My visit to @UCF made me wish I could be a college student all over again. https://t.co/o7FGsixIov,billgates
5/12/2018 14:44,9.95314E+17,Exciting to see how digital tech combined with human ingenuity is transforming the lives of the world’s poorest far… https://t.co/FuE4vC6bgw,billgates
5/11/2018 12:15,9.94914E+17,Dollar Street is a beautiful reminder that we all have more in common than we think: https://t.co/rUF4GUXIhm https://t.co/12cT1F82Di,billgates
5/10/2018 22:31,9.94706E+17,"RT @gatesfoundation: @ChrisJElias wants to #ThankATeacher - Michaela Raikes, an instructional specialist with @HighlineSchools in Washingto…",billgates
5/9/2018 12:00,9.94185E+17,"Cat ladies are everywhere, nearly everyone has a cell phone, and other surprising things you’ll learn on Dollar Str… https://t.co/Rit1S4XZzI",billgates
5/8/2018 17:30,9.93906E+17,I’m obsessed with this website. https://t.co/u4cT7zoovj,billgates
5/8/2018 3:15,9.93691E+17,"I’m incredibly optimistic about India’s future, which is one reason why I’m pleased to invest again in the country’… https://t.co/v8uLpyIE66",billgates
5/7/2018 12:00,9.9346E+17,Blanche Caffiere changed my life. She kept me challenged and engaged at a time when I easily could have gotten turn… https://t.co/Q5jBWkvyX7,billgates
5/7/2018 2:44,9.93321E+17,Real-world superheroes rarely make the headlines. But what if that wasn't the case? A stirring piece by Bollywood a… https://t.co/9o3h9REyCW,billgates
5/5/2018 14:22,9.92771E+17,The students who joined Melinda and me for this @60Minutes segment are incredible role models for other young peopl… https://t.co/3oG2RSZoAO,billgates
5/4/2018 12:46,9.92385E+17,America’s financial aid system is failing the students who need it the most: https://t.co/WFcOGReZvH https://t.co/C7xIzJMw0d,billgates
5/4/2018 5:23,9.92273E+17,A universal flu vaccine would be a huge boon to global health. That’s why our foundation is partnering with the Pag… https://t.co/4Tc9Aa9xr8,billgates
5/3/2018 16:16,9.92075E+17,"Of all the low-income high school seniors who qualify for federal student loans or grants, only half apply. Here ar… https://t.co/oAptHDcL8m",billgates
5/2/2018 21:05,9.91786E+17,A low-income student is five times less likely than a high-income student to have a college degree by age 24. Here’… https://t.co/B2TeIuhaBg,billgates
4/30/2018 12:00,9.90924E+17,We’re not ready for the next epidemic – but we can be. https://t.co/WbDexiGzMD,billgates
4/28/2018 14:26,9.90236E+17,"Last summer, I asked my followers to help me distribute 100,000 bed nets through @WorldVisionUSA. In this photo ess… https://t.co/dd7BUIzOoK",billgates
4/27/2018 12:12,9.8984E+17,This simple intervention could be an effective and scalable approach to saving children’s lives. https://t.co/XSo2vOUjPS,billgates
4/26/2018 18:03,9.89566E+17,I always enjoy being back at my alma mater… https://t.co/teoDhdN1kJ,billgates
4/26/2018 12:00,9.89474E+17,"Vaccines are a miracle. We have a shared responsibility to ensure that all children, no matter where they live, hav… https://t.co/W3HvhabFNd",billgates
4/25/2018 11:47,9.89109E+17,Today is #WorldMalariaDay. Join me in my latest VR video to find out what it will take to #endmalaria:… https://t.co/GwBU9X3fqM,billgates
4/25/2018 3:34,9.88985E+17,"Have #malaria deaths increased or decreased over the last 15 years?

Check you answer here: https://t.co/CWTIYuWVtU",billgates
4/24/2018 11:57,9.88749E+17,A mind-blowing fact...mosquitoes will kill more people today than sharks do in a century: https://t.co/qW2OWTgnt6 https://t.co/GYHaQCzu5K,billgates
4/23/2018 19:38,9.88502E+17,Mosquitoes are the greatest killers of all time. We have killed more people than all the wars in history. But no on… https://t.co/iLeZ1TXQg4,billgates
4/23/2018 18:10,9.8848E+17,"In 2016, sharks killed four people in the entire world. Diseases spread by mosquitoes killed more than half a milli… https://t.co/rowcwWT2ak",billgates
4/23/2018 17:07,9.88465E+17,Why does everyone hate mosquitoes? #IAmHartmut https://t.co/JlkjGZMbd8,billgates
4/22/2018 11:58,9.88024E+17,"This is a pivotal moment. We need to adapt to the climate change that is already affecting the planet, and develop… https://t.co/BbREENNnaW",billgates
4/21/2018 15:53,9.87721E+17,"Data nerds like me will enjoy this @planetmoney episode featuring one of my favorite economists, @MaxCRoser. https://t.co/i3EPm3iiZm",billgates
4/20/2018 21:37,9.87445E+17,Congrats to WA State Teacher of the Year @MandyRheaWrites on being named National Teacher of the Year. You’ve made… https://t.co/oovKUi31aZ,billgates
4/20/2018 15:24,9.87351E+17,@rogerfederer @TIME .@rogerfederer It’s a pleasure to follow your amazing work on and off the court.,billgates
4/20/2018 0:11,9.87121E+17,This is how we’ll win the war against malaria: https://t.co/N7cyVO9XT2 https://t.co/xp3QKsOmyB,billgates
4/19/2018 13:33,9.86961E+17,Congrats to my friend @johndoerr on “Measure What Matters.” John is right: companies can’t improve what they don’t… https://t.co/9IBqGYNtyb,billgates
4/18/2018 12:13,9.86578E+17,"As an investor, I’m always on the lookout for the next big idea. That’s why I was excited when our foundation signe… https://t.co/jFKpCJcuUT",billgates
4/17/2018 22:09,9.86366E+17,The UK is an indispensable partner in the fight against malaria. I’m excited about what we can continue to achieve… https://t.co/RB9NziMx46,billgates
4/17/2018 18:40,9.86313E+17,The world has made incredible progress in the fight against malaria -- but we can’t stop now. https://t.co/V4bpAz886r,billgates
4/17/2018 12:03,9.86213E+17,Congrats @Trevornoah on the launch of your foundation. I can’t wait to see what you accomplish. https://t.co/KJGyXz0NCh,billgates
4/17/2018 3:26,9.86083E+17,.@MohamedBinZayed and the UAE's strong commitment to the Global Polio Eradication Initiative is one reason we're cl… https://t.co/nfFNM8Qodj,billgates
4/16/2018 16:34,9.85919E+17,"1,200 scientists, 65,000 local officials, 140,000 industry representatives, and 21 million farmers. This is a story… https://t.co/Ri5zW01Fms",billgates
4/13/2018 16:48,9.84836E+17,Metamaterials are making the leap from lab to market. Here’s why they’re such an exciting area of research. https://t.co/vwi3DOdArp,billgates
4/12/2018 18:21,9.84497E+17,Can one person really make a difference? Here is one reason why my answer is yes: https://t.co/ss0HB0Xbux https://t.co/rATqf6JuW8,billgates
4/12/2018 11:53,9.84399E+17,I’ve read a couple @johngreen’s books and enjoyed them. Here’s why readers of all ages will enjoy his latest novel:… https://t.co/uLAszqlW2M,billgates
4/11/2018 15:39,9.84093E+17,Genome editing is one of the most powerful technologies of the 21st century. It’s important that new tools such as… https://t.co/KVvAvotcQm,billgates
4/10/2018 18:05,9.83768E+17,"“You’re not alone.”

This simple phrase has helped HIV survivor Cacilda Fumo save hundreds of lives every year. https://t.co/4xDQZzJ9q2",billgates
4/9/2018 16:49,9.83386E+17,Congrats to @henrytimms and @jeremyheimans  on “New Power.” Looks like an interesting read. https://t.co/P90Rzf4lBo,billgates
4/8/2018 14:11,9.82984E+17,"What we need is increased government and private sector support. Creating a zero-carbon future will take time, whic… https://t.co/fz4DsfHrih",billgates
4/8/2018 14:11,9.82984E+17,But I am more optimistic than he is. I think innovation—and the urgency brought on by climate change—will speed up… https://t.co/KMVf3lMxd5,billgates
4/8/2018 14:11,9.82984E+17,Smil is absolutely right that the transition to clean energy will not happen overnight. Here is a chart showing tha… https://t.co/vA7ERyNBEI,billgates
4/8/2018 14:11,9.82984E+17,Vaclav Smil is one of my favorite authors. I’ve read nearly all of his 37 books. This is an excellent overview of h… https://t.co/cWyFiLl7Uk,billgates
4/6/2018 14:38,9.82266E+17,Ironman triathlete and polio survivor @mindadentler’s story is incredible. Her commitment to eradicating the diseas… https://t.co/tpRFoJLjeR,billgates
4/5/2018 21:52,9.82013E+17,This is one of the most educational books I’ve ever read: https://t.co/6b6qd1k5Zc https://t.co/JUUgytq1BI,billgates
4/5/2018 16:22,9.8193E+17,Congrats to John Hennessy and David Patterson on receiving the Turing Award. The tech industry owes a debt of grati… https://t.co/2LaxVUXp1N,billgates
4/4/2018 14:03,9.81533E+17,"I can’t recommend Factfulness highly enough. Hans and two family members wrote it at the end of his life, and it’s… https://t.co/xSOpwwO6jT",billgates
4/4/2018 14:03,9.81533E+17,I use this one all the time: “Big numbers always look big. Small numbers on their own are misleading… Always look f… https://t.co/vxhgL1sqNC,billgates
4/4/2018 14:03,9.81533E+17,“Slow change is still change.” Extreme poverty has gone down by an average 2.5% per year in the last two decades. O… https://t.co/4jNXEXnUKX,billgates
4/4/2018 14:03,9.81533E+17,"“Give the system some credit.” It’s great to celebrate heroes (I do!). But there were heroes 1,000 years ago, and l… https://t.co/djsimLvu7E",billgates
4/4/2018 14:03,9.81533E+17,“Things can be both better and bad.” This is the heart of our foundation’s work. It’s bad that 5 million children d… https://t.co/JOfNihL2Mr,billgates
4/4/2018 14:03,9.81533E+17,"“Factfulness,” by the late Hans Rosling, is one of the best books I’ve read in a long time. It’s a great guide to t… https://t.co/jYzlliP8tz",billgates
4/3/2018 17:32,9.81223E+17,It’s hard to pick up on progress if you divide the world into developed countries and developing countries. In his… https://t.co/XPo24525gk,billgates
4/2/2018 21:00,9.80913E+17,Good news: the world’s newest country reported zero cases of Guinea worm in 2017 and hasn’t had a case in 15 months. https://t.co/uOo4MMEtFm,billgates
3/31/2018 12:00,9.80052E+17,"My family loved talking about this book at the dinner table, and I think yours will, too. https://t.co/vVqVFlTSG0",billgates
3/29/2018 20:45,9.79459E+17,It was great to visit @MSFTResearch TechFest. I’m always inspired to see the incredible research the company is inf… https://t.co/tCysXLcsqV,billgates
3/29/2018 16:53,9.79401E+17,"Thank you, @tmyerson, for your leadership and your contributions. You’ve made a lasting impact on Microsoft. I look… https://t.co/u5VrNaoHg7",billgates
3/28/2018 20:16,9.7909E+17,"I had a lot of fun at @bigbangtheory. Luckily, I packed an extra tie. https://t.co/dAS2O4ihus",billgates
3/28/2018 12:07,9.78967E+17,I was impressed and inspired by the way Pete Peterson brought together brilliant people to take on tough problems l… https://t.co/L0lcpgwkmG,billgates
3/27/2018 21:59,9.78754E+17,My daughter Phoebe and I love reading all kinds of books and are big fans of @johngreen. Here are her (and my) thou… https://t.co/eoPJDJjShX,billgates
3/27/2018 17:20,9.78683E+17,Energy innovation is not a zero-sum game. That’s why our clean-energy investment fund @btenergy is partnering with… https://t.co/snOemzdass,billgates
3/27/2018 16:13,9.78666E+17,Great visit to Nigeria and Chad with my friend @AlikoDangote this week to talk about the importance of eradicating… https://t.co/BBUJ6IhMgr,billgates
3/26/2018 22:08,9.78393E+17,Grateful to @ProfOsinbajo for his initiative in convening the National Economic Council on investment in people—and… https://t.co/vZ70pEUZ2k,billgates
3/26/2018 20:11,9.78364E+17,I was excited to visit Nigeria and meet with @MBuhari and @ProfOsinbajo to discuss the country’s development goals.… https://t.co/t4UrDxusSI,billgates
3/23/2018 16:34,9.77222E+17,Companies in Nigeria are taking a big step to end stunting and malnutrition. This commitment will build healthier a… https://t.co/lfNBpnoTyv,billgates
3/22/2018 21:05,9.76928E+17,I’m hopeful we can alter the course of Alzheimer's if we invest in research to better understand how the disease un… https://t.co/dimiCKjSTm,billgates
3/22/2018 16:43,9.76862E+17,Strong health systems promote strong economic growth. Nigeria’s investments in its communities will yield benefits… https://t.co/ooPzXXDpJu,billgates
3/16/2018 16:53,9.7469E+17,Advances in agriculture can have a big impact on the lives of the world’s poorest. I’m particularly excited about n… https://t.co/MwfYRiJxaQ,billgates
3/15/2018 19:01,9.7436E+17,Superintendent Jorge Aguilar uses data to make a difference in the lives of students in Sacramento. We talked about… https://t.co/cl3HXF8NZw,billgates
3/14/2018 20:05,9.74014E+17,"Developing affordable, clean energy for all is one of the smartest public investments our country can make. We need… https://t.co/kuItobiiHm",billgates
3/14/2018 17:44,9.73978E+17,I feel lucky to have known Stephen Hawking. His work is an inspiring reminder of what human minds are capable of.,billgates
3/13/2018 20:40,9.7366E+17,I often meet with educators who have creative ideas about how to make school systems work for every child. Recently… https://t.co/XNmomaleyk,billgates
3/11/2018 20:09,9.72928E+17,RT @melindagates: Join us at #sxsw for a conversation about how we can make our workplaces work better for everyone. Watch live at 2 pm CT.…,billgates
3/9/2018 13:46,9.72106E+17,I can always count on my friend Warren Buffett to give good advice. His latest annual letter to shareholders has gr… https://t.co/m4CafLRJCl,billgates
3/8/2018 23:16,9.71888E+17,Being an optimist doesn't mean you get complacent. It means you constantly look for ways to make the world better.… https://t.co/s0WG4CbF0y,billgates
3/8/2018 15:13,9.71766E+17,"The evidence is clear: if you want to empower women and girls, give them the power to decide what to do with their… https://t.co/CGSjPRMKdZ",billgates
3/8/2018 2:23,9.71572E+17,Tomorrow is #IWD2018 — a day when the world celebrates the progress made by and for women. I’m inspired by Ellen Jo… https://t.co/XK89x0A4zG,billgates
3/6/2018 21:41,9.71139E+17,Most people know @rogerfederer as one of the greatest tennis players of all time. But his work off the court is als… https://t.co/Z7vM4TA48y,billgates
3/6/2018 1:04,9.70827E+17,"Proud to be on Team Fed. We’re ready for you, @SavannahGuthrie and @JackSock: https://t.co/tUifhNNBVO… https://t.co/daxpSiBR6R",billgates
3/5/2018 17:00,9.70706E+17,Everyone benefits when women can fully participate in the economy. https://t.co/yi0vu4cpUr,billgates
3/4/2018 18:46,9.7037E+17,The sun is the most plentiful source of renewable energy we have -- and the race is on to harness its power. https://t.co/qWt0LWwXbd,billgates
3/1/2018 17:08,9.69258E+17,"As @KofiAnnan writes, cutting-edge mapping efforts have helped us understand the burden of health and nutrition dis… https://t.co/vr5xoe0zd9",billgates
2/28/2018 18:15,9.68912E+17,"See you on the court, @SavannahGuthrie! https://t.co/9k7Mf8Pb6I",billgates
2/27/2018 19:00,9.68562E+17,I’m on @reddit right now if you want to ask me anything: https://t.co/HXMsI0lSK1 https://t.co/1UxthPgCjz,billgates
2/27/2018 15:40,9.68511E+17,Here are 4 things I won’t be doing today… and one thing I will: https://t.co/HXMsI04hSt https://t.co/ojUrcXu8IU,billgates
2/26/2018 21:11,9.68232E+17,Does the world suck? Not as much as you might think. https://t.co/JM5KMeQbxb,billgates
2/24/2018 17:21,9.67449E+17,"People today are living longer, healthier, and happier lives than ever before. I asked @sapinker to explain why. https://t.co/697JymQI5p",billgates
2/23/2018 21:39,9.67152E+17,The idea that children shouldn’t die of malaria isn’t just our value. It’s a human value. Parents in every culture… https://t.co/dDX18DlmzE,billgates
2/23/2018 15:04,9.67053E+17,".@melindagates talks about the experience that opened our eyes to the inequities in the world, and the incredible p… https://t.co/T79HNEDvlH",billgates
2/22/2018 14:32,9.66682E+17,"At Microsoft, I got deep into computer science. At the foundation, it’s computer science plus biology, chemistry, a… https://t.co/srDFDBMeww",billgates
2/21/2018 15:10,9.66329E+17,"Last year, Melinda and I took a trip to Atlanta, Georgia. What we saw reinforced our belief that education is the b… https://t.co/nY8jSVO0JM",billgates
2/19/2018 15:47,9.65614E+17,"Although there’s been some progress over the past decade, America’s public schools are still falling short on impor… https://t.co/WSc6DYJK3c",billgates
2/18/2018 16:43,9.65266E+17,Although Melinda and I see a lot of disease and poverty in our travels—and many other big problems that need to be… https://t.co/ss794Wxlsp,billgates
2/17/2018 13:49,9.64859E+17,"As counterintuitive as it may seem, population sizes don’t go up as the world gets healthier. They go down:… https://t.co/WManiNlvMm",billgates
2/14/2018 14:40,9.63785E+17,Melinda and I got a kick out of doing our first autocomplete challenge. We answer more tough questions in our Annua… https://t.co/kigaYtSSlF,billgates
2/13/2018 17:05,9.63459E+17,I’m on Facebook Live with @melindagates and @Lin_Manuel to discuss why we’re more optimistic than ever:… https://t.co/d6XOAfsyfw,billgates
2/13/2018 10:03,9.63353E+17,"This is our 10th Annual Letter, and we’re marking the occasion by answering 10 tough questions that people ask us. https://t.co/MKVcpD9ZBZ",billgates
2/7/2018 14:46,9.6125E+17,Today marks one year since our dear friend Hans Rosling’s passing. If you want to know more about Hans and his work… https://t.co/w75fEFh1Iq,billgates
2/5/2018 14:45,9.60525E+17,You’re 37 times less likely to be killed today by a lightning bolt than you were at the turn of the 20th century –… https://t.co/UMsBWyJBMC,billgates
2/2/2018 18:39,9.59496E+17,I love stories like this… 14-year-old Emma Yang is developing an app to help bridge the gap between Alzheimer's pat… https://t.co/4V9sKctK7K,billgates
2/1/2018 4:38,9.58922E+17,"Welcome to the Giving Pledge, @drshamsheervp. You approach philanthropy with the spirit of an entrepreneur and the… https://t.co/sANpGa2eQG",billgates
1/31/2018 14:50,9.58714E+17,My family’s experience has exposed me to how awful it feels when a loved one is diagnosed with Alzheimer’s. I spoke… https://t.co/6cPF07YSOg,billgates
1/30/2018 20:38,9.58439E+17,I’ve spent a lot of time thinking about how the information we consume shapes our perception of the world. I’m glad… https://t.co/UMj9XnFO77,billgates
1/30/2018 14:58,9.58354E+17,"Since my early days as a programmer, I’ve been fascinated by computers. I was thrilled when @codeorg asked me to he… https://t.co/IZXyXYWIBv",billgates
1/29/2018 15:06,9.57993E+17,I can’t wait for readers to get their hands on my new favorite book. You can download a free chapter of “Enlightenm… https://t.co/oDVYNVjESI,billgates
1/28/2018 15:51,9.57642E+17,"Congrats, @rogerfederer, on winning your 20th Grand Slam. Can’t wait to see your game up close on March 5 at the #MatchforAfrica.",billgates
1/27/2018 16:53,9.57296E+17,"I sat down with @sapinker and @SocialQPhilip to talk about Steven’s upcoming book, “Enlightenment Now.” I came away… https://t.co/g2tbQXGxN6",billgates
1/26/2018 14:34,9.56898E+17,"RT @melindagates: This week, leaders from business and government are convening in Davos for #WEF18. I have a message for them: it’s time t…",billgates
