Datetime,Tweet Id,Text,User
1/18/2021 19:54,1.35126E+18,"#MLKDay has long been a national day of service. As we celebrate the first without Congressman John Lewis, I'm thin… https://t.co/wJd8BoRmzz",billgates
1/4/2021 19:59,1.34618E+18,It’s great to see India’s leadership in scientific innovation and vaccine manufacturing capability as the world wor… https://t.co/XR68nmXE3g,billgates
12/29/2020 18:14,1.34398E+18,RT @lastmilehealth: The best emergency system is a strong primary health system—powered by community and frontline health workers. Now is t…,billgates
12/28/2020 13:44,1.34355E+18,What does Rashida Jones have on her shopping list? That’s just one of the many questions that didn’t make it into o… https://t.co/12zZthysds,billgates
12/22/2020 18:58,1.34146E+18,2021 will be better than 2020. Here’s why: https://t.co/mYbpl5wwF1,billgates
12/19/2020 19:02,1.34037E+18,Standing up for science has never been more important. Congratulations to Dr. Anthony Fauci and Dr. Salim Abdool Ka… https://t.co/Hz9CNhMWJg,billgates
12/19/2020 2:48,1.34013E+18,I've known and learned from @RonConway for more than 40 years. I'm glad to see @svangel team up with @bchesky to me… https://t.co/L501h9Nt6X,billgates
12/18/2020 17:04,1.33998E+18,This book has nothing to do with viruses or pandemics. But it is surprisingly relevant for these times. @exlarson p… https://t.co/MvmKkI0KWV,billgates
12/18/2020 1:25,1.33974E+18,"Monoclonal antibodies are one of the most promising treatments we have for COVID-19, thanks in large part to R&amp;D by… https://t.co/Ju40p3jnYc",billgates
12/17/2020 18:07,1.33963E+18,"RT @AlzData: We’re looking for new ways to advance #AlzheimersResearch. If you have an idea for tools, models, or algorithms that will expa…",billgates
12/15/2020 20:42,1.33895E+18,"Like many people, I’ve tried to deepen my understanding of systemic racism in recent months. If you’re interested i… https://t.co/LNagIsh9Hy",billgates
12/14/2020 23:37,1.33863E+18,The season finale of our podcast features two incredible people who are using their positions as artists to change… https://t.co/QW6EsPpN48,billgates
12/13/2020 0:07,1.33791E+18,"RT @MalariaNoMore: Since 2000, the #malaria community has worked together to prevent 1.5 billion cases of #malaria &amp; save 7.6 million lives…",billgates
12/11/2020 23:55,1.33755E+18,"Thanks for the great conversation, Carlos. https://t.co/DaCxoadvH1",billgates
12/10/2020 18:45,1.33711E+18,"RT @gatesfoundation: We must ensure these innovations reach everyone, not just those who can afford to pay. Our newest commitment to the CO…",billgates
12/9/2020 19:16,1.33675E+18,Bill Foege and Viktor Zdanov are phenomenal examples of what it means to harness science for global health. A well-… https://t.co/aAfY5irhja,billgates
12/8/2020 17:47,1.33637E+18,Here are five books that I’d recommend as we wrap up 2020. I hope you find something that helps you—or the book lov… https://t.co/gDot5eEwpd,billgates
12/7/2020 19:20,1.33603E+18,Are we actually making progress on climate change? Can we really prevent a climate disaster? In this week’s podcast… https://t.co/moCs77V9O7,billgates
12/5/2020 15:36,1.33525E+18,This new quiz from @Gapminder is a clever way to fight misconceptions and “upgrade your worldview” about the incred… https://t.co/WaJPw3zemy,billgates
12/4/2020 17:11,1.33491E+18,"Rashida Jones and I talked to Yuval Noah Harari about COVID conspiracy theories, the role social media plays in spr… https://t.co/309JMVRmUZ",billgates
12/3/2020 17:28,1.33455E+18,"I believe we can avoid a climate disaster—if we deploy the clean-energy tools we have now wisely, and if we make bi… https://t.co/cVpVwCGBsT",billgates
12/3/2020 17:28,1.33455E+18,"To reduce duplication, focus the government’s efforts, and get the most innovation out of every dollar of funding,… https://t.co/bqI2CXdytX",billgates
12/3/2020 17:28,1.33455E+18,"We need to revolutionize the world’s physical economy—and that will take, among other things, a dramatic infusion o… https://t.co/IJ63PHKa1p",billgates
12/3/2020 17:28,1.33455E+18,This the most important thing the U.S. can do to lead the world in innovations that will solve climate change. https://t.co/LG9uOnM92r,billgates
12/1/2020 18:37,1.33384E+18,I’m inspired by Quarraisha Abdool Karim and @ProfAbdoolKarim. They are two of the most respected HIV/AIDS researche… https://t.co/zrvrc5Uws5,billgates
12/1/2020 16:31,1.33381E+18,"RT @melindagates: My parents taught me to leave the world better than I found it. 

So many people across the country believe in giving bac…",billgates
11/30/2020 19:23,1.33349E+18,I’m a big fan of author @harari_yuval and was excited to talk to him about why humanity is so willing to believe fa… https://t.co/S8MHb5PDTJ,billgates
11/25/2020 18:04,1.33166E+18,"RT @GlobalFund: “I will continue fighting. I will continue supporting other patients. I will never give up.”

Meet Aftab, a multi-drug resi…",billgates
11/24/2020 18:21,1.3313E+18,"Today is the 25th anniversary of my first book, The Road Ahead. I made a lot of predictions about technology in the… https://t.co/z99oAvwhyw",billgates
11/23/2020 19:41,1.33096E+18,"This week, Rashida and I ask a big question that has never felt more urgent: is inequality inevitable? We spoke wit… https://t.co/w0rI1CCwnq",billgates
11/22/2020 19:31,1.33059E+18,RT @gavi: How can the fight to #endpolio help inform the  #COVID19 response? The @unfoundation’s Elizabeth Thrush looks at how the lessons…,billgates
11/20/2020 18:34,1.32986E+18,You can listen to a bonus clip that didn’t make it into our latest episode here: https://t.co/5diXiKpEnx https://t.co/PZsCSsWx6N,billgates
11/20/2020 17:18,1.32984E+18,RT @TheDailyShow: Full interview with @BillGates: https://t.co/5WtQxlfTm8,billgates
11/17/2020 21:22,1.32881E+18,Nearly forty million people have Alzheimer’s or dementia today. We have no way to stop or even slow the disease at… https://t.co/MFTfY6PExp,billgates
11/16/2020 18:38,1.32841E+18,"In our first podcast episode, Rashida Jones and I talked to Dr. Anthony Fauci about what to expect in the coming mo… https://t.co/rjDo25g3Pe",billgates
11/15/2020 19:03,1.32805E+18,"More than 7 million community health workers serve their neighbors around the world, improving access to primary he… https://t.co/wPcsq1LYut",billgates
11/12/2020 23:18,1.32703E+18,RT @melindagates: No one is safe from COVID-19 until everyone is safe. We started the foundation because we believe every person deserves t…,billgates
11/12/2020 18:23,1.32695E+18,"Each week, we’ll talk about some of the biggest issues facing our world with special guests including authors, expe… https://t.co/EkJlm5B4xy",billgates
11/12/2020 18:23,1.32695E+18,I’m teaming up with Rashida Jones to ask the big questions. Check out our new podcast limited series starting Monda… https://t.co/pYmfGS3cLm,billgates
11/7/2020 18:09,1.32514E+18,I look forward to working with the new administration and leaders on both sides in Congress on getting the surging… https://t.co/gvzwK8jw1B,billgates
11/7/2020 18:09,1.32514E+18,Congratulations to President-Elect Biden and Vice President-Elect Harris. Thank you to the election officials and c… https://t.co/NJlztq44t7,billgates
10/28/2020 20:07,1.32154E+18,"Here in Washington, we always vote by mail. It's a safe and secure way to shape the future of our country. But rega… https://t.co/wGSCJYxxY1",billgates
10/27/2020 15:53,1.32112E+18,@MohamedBinZayed The UAE is an essential partner in stopping polio in Pakistan. Thank you @MohamedBinZayed for your… https://t.co/5xQEZ8CpUL,billgates
10/23/2020 18:49,1.31971E+18,"For decades, @Rotary has worked tirelessly to #EndPolio. Today, the health infrastructure they’ve built around the… https://t.co/vYYV7djNsE",billgates
10/20/2020 18:30,1.31862E+18,"RT @StephenCurry30: Even with his busy schedule, Dr. Fauci took the time to sit down with me (AGAIN) and talk about what we’ve gotten right…",billgates
10/19/2020 20:48,1.31829E+18,I’ve been working for some time on a book about what we need to do over the next decade to avoid a climate disaster… https://t.co/UvV6cRjxOW,billgates
10/19/2020 20:48,1.31829E+18,"It’s inspiring to see so much passion these days for dealing with climate change, and to know that the world has se… https://t.co/9F4HMYnG3m",billgates
10/19/2020 18:09,1.31825E+18,India’s research and manufacturing capacity are critical for fighting COVID-19. Thank you @narendramodi for speakin… https://t.co/6tXltL7gAr,billgates
10/16/2020 20:03,1.31719E+18,Europe has an opportunity to get its economy back on track in a way that creates good jobs and reinforces its globa… https://t.co/lWhwWXDbR2,billgates
10/16/2020 15:44,1.31713E+18,"The COVID-19 pandemic has set back efforts to end poverty, hunger, and malnutrition. Investing in @CGIAR will speed… https://t.co/hptIDi9uGC",billgates
10/13/2020 20:14,1.31611E+18,.@StephenCurry30’s work in the community is as inspiring as his amazing record on the basketball court. I really ap… https://t.co/88z3R8zJcO,billgates
10/12/2020 4:23,1.31551E+18,Dr. Tunji Funsho’s work with @Rotary was essential in stopping wild polio in Africa and will help create a polio-fr… https://t.co/tK7JInphtM,billgates
10/9/2020 16:21,1.3146E+18,"This honor is well deserved. COVID-19 is not just a health crisis—it is also now a food crisis, and @WFP is there t… https://t.co/17KZ94c44u",billgates
10/7/2020 14:51,1.31385E+18,"For the last 25 years, Dr. Firdausi Qadri, an immunologist and infectious disease researcher in Bangladesh, has bee… https://t.co/s0OJIXc0rg",billgates
10/1/2020 17:43,1.31172E+18,I’m excited to see this kind of innovation. Detecting and predicting outbreaks earlier is critical to preventing ep… https://t.co/cxkQeKAATG,billgates
9/30/2020 18:30,1.31137E+18,The only way to eliminate the threat of COVID-19 somewhere is to eliminate it everywhere. By making sure poor count… https://t.co/Q3OcJVBEfK,billgates
9/29/2020 22:56,1.31108E+18,Understanding this concept can help us measure our progress toward eliminating carbon emissions and serve as a guid… https://t.co/jLEgEEqwRk,billgates
9/28/2020 18:06,1.31064E+18,Developing and manufacturing vaccines won’t end the pandemic quickly unless we also deliver them equitably. Here is… https://t.co/HsEwAdilhO,billgates
9/26/2020 17:08,1.3099E+18,Great to see the UK commit vital funding to ensure COVID-19 vaccines are available for the world’s poorest people.… https://t.co/GxJeVtw0hN,billgates
9/25/2020 17:07,1.30954E+18,"RT @gatesfoundation: What do COVID-19 and malaria have to do with each other?  

When COVID-19 struck, it disrupted the entire global healt…",billgates
9/24/2020 20:28,1.30923E+18,"After 20 years of stunning advances toward global goals to improve health and reduce poverty, the COVID-19 pandemic… https://t.co/VMWuXK8bXL",billgates
9/24/2020 15:06,1.30915E+18,"To prevent the worst effects of climate change, we need innovation across all sectors—especially in the hardest to… https://t.co/eop0Xg5jjz",billgates
9/23/2020 21:05,1.30888E+18,Dr. John Nkengasong is a true Goalkeeper. His leadership will help ensure Africa has the tools it needs to fight CO… https://t.co/uVlSrcO81A,billgates
9/19/2020 1:03,1.30712E+18,"Justice Ginsburg was a trailblazer who devoted her entire career to fighting for equal justice for women, because s… https://t.co/R8orT60oYR",billgates
9/15/2020 22:13,1.30599E+18,"My dad was the “real” Bill Gates. He was everything I try to be and I will miss him every day.

https://t.co/OnAEsmosNb",billgates
9/12/2020 16:21,1.30482E+18,Thank you to the heroes everywhere working to keep us safe. I hope their stories inspire you just as much as they h… https://t.co/9s9ZlVLVfx,billgates
9/10/2020 14:55,1.30407E+18,These heroes represent the best of who we can be. Their efforts to solve the world’s challenges demonstrate our val… https://t.co/jSw8GodVDt,billgates
9/4/2020 18:43,1.30195E+18,"RT @OurWorldInData: Some countries responded successfully to the pandemic – and more broadly, some are much more successful in protecting t…",billgates
9/3/2020 19:33,1.3016E+18,Clinical trials are critical to helping researchers better understand Alzheimer's. Improving how we identify and en… https://t.co/mFHVL5f2bL,billgates
9/1/2020 21:00,1.3009E+18,I tackle every big new problem by asking two questions: Who has dealt with this problem well? And what can we learn… https://t.co/ilTwmtaDo9,billgates
8/30/2020 16:37,1.30011E+18,"Of all the things I’ve learned from Warren Buffett (and there have been a lot), the most important might be what fr… https://t.co/EAZqaJvTXM",billgates
8/30/2020 16:37,1.30011E+18,"Happy 90th birthday, Warren! https://t.co/8nH2EulTR4",billgates
8/28/2020 22:30,1.29947E+18,".@AbeShinzo, thank you for making the world a healthier and more equitable place. Your understanding of how we can… https://t.co/l8siKS3IbS",billgates
8/27/2020 22:24,1.29911E+18,"RT @UN: 6 months ago, Africa confirmed its first case of #COVID19. Since then, there have been 1 million cases, affecting every country on…",billgates
8/26/2020 15:11,1.29864E+18,"If we’re going to address climate change, we need to find new ways to do things that don’t release greenhouse gases… https://t.co/BR0LArA407",billgates
8/25/2020 18:09,1.29832E+18,Today we move one step closer toward a world without polio. This is an incredible milestone that’s worth celebratin… https://t.co/loaPZ2cUDu,billgates
8/25/2020 17:52,1.29832E+18,"RT @gatesfoundation: Thanks to the commitment of leaders from all 47 countries in the @WHOAFRO Region, history was made today: the entire A…",billgates
8/22/2020 17:11,1.29722E+18,Mosquito City is home to the world’s largest captive colony of mosquitoes. @IfakaraHealth Institute is doing fascin… https://t.co/r0tcErXy7z,billgates
8/20/2020 15:48,1.29647E+18,Deaths from malaria have been cut by more than half since the year 2000. Increased bed net use is one of the main r… https://t.co/98RaR7G9k4,billgates
8/20/2020 15:36,1.29647E+18,RT @gavi: Vaccines prevent millions of deaths every year by harnessing the body’s immune system to create defences against future infection…,billgates
8/19/2020 15:06,1.2961E+18,"Ridding the world of preventable, treatable diseases like malaria will save millions of lives and lead to healthier… https://t.co/QdDgfvtV7E",billgates
8/18/2020 21:09,1.29583E+18,"RT @GlobalFund: As a community health worker in Kenya’s Homa Bay County, Evaline has helped her community dramatically reduce the number of…",billgates
8/18/2020 15:35,1.29575E+18,The progress the world has made against malaria is one of the greatest success stories ever. The COVID-19 pandemic… https://t.co/xUPL8djbUO,billgates
8/17/2020 17:35,1.29541E+18,"Move aside, @SharkWeek. This is the still the world’s deadliest killer: https://t.co/AOi5VSmfLF https://t.co/3GLwnkinlI",billgates
8/16/2020 23:29,1.29514E+18,"RT @CEPIvaccines: A safe and effective #COVID19 vaccine is the way out of this devastating pandemic🌍

Our Director of Vaccine R&amp;D, Melanie…",billgates
8/13/2020 16:22,1.29395E+18,"Because of long-standing barriers that are made worse by COVID-19, hundreds of thousands of students with promise m… https://t.co/iRbh6lxk7U",billgates
8/13/2020 2:49,1.29374E+18,"RT @trevormundel: This commitment is critical. “Additional manufacturing capacity to begin producing doses for every country, not just the…",billgates
8/12/2020 20:40,1.29365E+18,Teaching special education takes an amazing person to figure out exactly what works for each child. Talking with Wa… https://t.co/s338InanKn,billgates
8/11/2020 23:06,1.29332E+18,"RT @antonioguterres: Last month, over 1 billion students were affected by #COVID19 school closures.

Even before the pandemic, the world wa…",billgates
8/11/2020 15:01,1.2932E+18,Our foundation is partnering with @DonorsChoose to support teachers as they get ready to go back to school—in whate… https://t.co/zpfk2JZ0xY,billgates
8/10/2020 19:19,1.2929E+18,"I always look forward to meeting Washington’s Teacher of the Year. This year’s recipient, Amy Campbell (… https://t.co/F0KKa1AXpM",billgates
8/10/2020 4:02,1.29267E+18,Bill Foege was instrumental in the effort to eradicate smallpox (and is a personal hero of mine). Here he outlines… https://t.co/wW50rer8nV,billgates
8/7/2020 18:01,1.2918E+18,The world did not do enough to prepare for a pandemic. We can avoid making the same mistake with climate change by:… https://t.co/Unsu8k1WNd,billgates
8/6/2020 23:32,1.29152E+18,Great tips from @CT_Bergstrom about how to find reliable sources of information and test claims you may see about t… https://t.co/ilSyL28lek,billgates
8/6/2020 20:46,1.29148E+18,"RT @exemplarshealth: In our recent webinar, @doctorsoumya called for community-led responses to #coronavirus. These types of engagements ha…",billgates
8/4/2020 19:51,1.29074E+18,"If we learn the lessons of COVID-19, we can approach climate change more informed about the consequences of inactio… https://t.co/vWILVypq4d",billgates
7/31/2020 18:27,1.28927E+18,"In his final words, John Lewis challenges all of us to continue to stand up for what we truly believe. “Together, y… https://t.co/WdmF55ekNb",billgates
7/31/2020 0:25,1.28899E+18,"The impacts of COVID-19 are driving worrying increases in malnutrition and health outcomes. However, there are clea… https://t.co/eDjJJPt535",billgates
7/30/2020 23:19,1.28898E+18,RT @trevormundel: The @WorldBank’s support of @CEPIvaccines and @gavi is instrumental to the research and development of the #COVID19 vacci…,billgates
7/30/2020 16:11,1.28887E+18,"In these challenging times, we can’t lose sight of the importance of combatting climate change. I’m excited to hear… https://t.co/wQkppRX94t",billgates
7/29/2020 23:19,1.28862E+18,Science and innovation will help us beat COVID-19. Dr. Fauci explains why. https://t.co/ZL597r4pNZ,billgates
7/29/2020 22:43,1.28861E+18,It’s important that we continue to follow scientific data as we look for new tools to aid in the fight against coro… https://t.co/E6bRxMduwK,billgates
7/29/2020 20:58,1.28858E+18,"RT @eji_org: ""We all have an obligation, a mission, and a mandate to do what we can. We must speak up for those who have been left out and…",billgates
7/29/2020 20:41,1.28858E+18,"“I truly believe that if there is faith and hope and determination, we can continue to lay progress and create an A… https://t.co/9cbxUamx77",billgates
7/29/2020 14:42,1.28849E+18,"It’s hard to overstate how important finding a reliable, affordable, and easy-to-use diagnostic is for stopping Alz… https://t.co/hFpfn4MiVO",billgates
7/28/2020 19:02,1.28819E+18,Investments in digital technology that strengthen Africa’s food and health security will be critical to help the co… https://t.co/DOuyykc74j,billgates
7/28/2020 0:26,1.28791E+18,"RT @gatesfoundation: Three lessons that have been central to the #COVID19 response in South Africa, Liberia, &amp; other countries:
🔸 Screening…",billgates
7/24/2020 18:26,1.28673E+18,"""Our best strategy in the age-old fight against the germs is our collaborative, data-based effort to study the worl… https://t.co/hGDwr7BZAV",billgates
7/18/2020 6:04,1.28437E+18,"RT @BarackObama: Not many of us get to live to see our own legacy play out in such a meaningful, remarkable way. John Lewis did:

https://t…",billgates
7/18/2020 4:29,1.28434E+18,"This is a great loss for America, and for everyone who believes in making the world a more just place. John Lewis n… https://t.co/gomyfL9ZyT",billgates
7/17/2020 16:01,1.28416E+18,"RT @melindagates: Decision-makers can take steps right now to make sure the world recovers from this pandemic stronger, more prepared &amp; mor…",billgates
7/2/2020 18:54,1.27876E+18,"Globally, a lack of medical oxygen–needed to treat pneumonia, malaria, and other diseases–leads to hundreds of thou… https://t.co/3Rtm8Wdl4Y",billgates
7/2/2020 18:54,1.27876E+18,This hero is playing a critical role in Kenya’s preparations to tackle COVID-19 by scaling up medical oxygen suppli… https://t.co/Ojv4QIiGuA,billgates
6/19/2020 21:39,1.27409E+18,RT @MichelleObama: Here's what #Juneteenth means to me: https://t.co/KlOoYwdzD5,billgates
6/19/2020 21:38,1.27409E+18,RT @NavigatingNikki: “It’s that clarity of language about the VALUE of black life in America that distinguishes #Juneteenth as emancipation…,billgates
6/19/2020 21:38,1.27409E+18,"RT @nationalbook: ""And I’ll never lose my faith that you and I can create an anti-racist America where racial disparities are nonexistent.…",billgates
6/19/2020 21:38,1.27409E+18,"RT @ClintSmithIII: When I think of emancipation, I think of all of the people who fought for freedom but who never got a chance to experien…",billgates
6/19/2020 19:39,1.27406E+18,RT @kcarterjackson: Happy Juneteenth fam! My latest for the @TheAtlantic. Find joy today! The images from the article alone are giving me l…,billgates
6/19/2020 19:26,1.27406E+18,"RT @JohnBKing: Thinking today about my great-grandfather &amp; his family who were enslaved here in Montgomery County, Maryland (just about 25…",billgates
6/19/2020 19:15,1.27406E+18,"RT @ava: “Only those feigning blindness fail to see the body of work we are, and the work of body we have done. 

Everything is what it is…",billgates
6/19/2020 18:50,1.27405E+18,RT @maejemison: #Juneteenth recognizes &amp; celebrates Black people’s freedom and the end of slavery in the US!  19 Jun 1865 Union Army Genera…,billgates
6/19/2020 17:16,1.27403E+18,RT @eji_org: It's time to end the silence about our history of racial injustice in America. #Juneteenth https://t.co/AlNI2ZdCx6,billgates
6/19/2020 17:04,1.27403E+18,RT @ProfessorEA: Proud to share my thoughts in @NewYorker’s “injustice issue” on (and for) our beloved young people I call the #TrayvonGene…,billgates
6/19/2020 16:54,1.27402E+18,"RT @Lupita_Nyongo: 1. This is Opal Lee, the force behind the movement to make #Juneteenth a national holiday. Also known as Freedom Day, it…",billgates
6/10/2020 3:49,1.27056E+18,I am committed to listening and learning more about systemic racism and what I can do with my actions and words to… https://t.co/EVoXxjwkHs,billgates
6/10/2020 3:49,1.27056E+18,"…in policing, criminal justice, education, health care, housing, the workplace and all other areas of their lives.",billgates
6/10/2020 3:49,1.27056E+18,"The horrifying killings of George Floyd, Ahmaud Arbery, Breonna Taylor and far too many other Black people—and the… https://t.co/LrFddJnXtA",billgates
6/4/2020 18:21,1.26861E+18,RT @gatesfoundation: Today world leaders pledged to fully support @gavi’s mission to give more children access to lifesaving vaccines and b…,billgates
6/1/2020 2:53,1.26729E+18,RT @melindagates: The video of George Floyd’s brutal death broke my heart. I’ve watched the protests that followed and have felt overwhelme…,billgates
5/27/2020 22:22,1.26577E+18,I continue to be inspired by all of the volunteers (including many retired health care workers and teachers) on the… https://t.co/GM6J6ApHXa,billgates
5/26/2020 16:16,1.26532E+18,Here are five books to read this summer if you want to learn more about pandemics or are looking for a distraction:… https://t.co/eDMA8Kj76K,billgates
5/22/2020 17:00,1.26388E+18,"Melinda recommended that I read The Choice, and I’m glad she did. I think many people will find comfort right now f… https://t.co/8jDdEb2Ssd",billgates
5/21/2020 18:45,1.26354E+18,Today is #RedNoseDay. Their work has made an incredible impact to reduce child poverty in the US and around the wor… https://t.co/wCNP7DH1BO,billgates
5/20/2020 17:00,1.26315E+18,The 1918 influenza outbreak is the closest comparison to what we’re living through right now. John Barry does a gre… https://t.co/PJsMGKq4IC,billgates
5/18/2020 17:24,1.26243E+18,"Most of my conversations these days are about COVID-19 and how we can stem the tide, but I’m also often asked about… https://t.co/ESUplKBXWV",billgates
5/14/2020 21:11,1.26104E+18,"@narendramodi @gatesfoundation Thank you for the conversation and partnership, @narendramodi. Combating the pandemi… https://t.co/DgNdfOMLs0",billgates
5/13/2020 1:02,1.26037E+18,I’m hopeful that this program will improve our understanding of the coronavirus outbreak in Seattle and provide val… https://t.co/P53zeSRIgu,billgates
5/7/2020 20:40,1.2585E+18,"RT @melindagates: When will America be able to get back to work? 

The answer depends on whether workers have caregiving options they can r…",billgates
5/5/2020 17:49,1.25773E+18,"Class of 2020, these are not easy times. But we will get through them. And with your leadership, the world will be… https://t.co/4YIkZUxrRz",billgates
5/4/2020 21:19,1.25742E+18,RT @melindagates: To overcome #COVID19 the world doesn’t just need science. It needs a commitment to help people beat this virus wherever t…,billgates
5/1/2020 18:39,1.25629E+18,There are over 100 different coronavirus vaccine candidates in the works. These candidates take a variety of approa… https://t.co/89T7HmIkFU,billgates
4/30/2020 16:50,1.2559E+18,Humankind has never had a more urgent task than creating broad immunity for coronavirus. It’s going to require a gl… https://t.co/PvTGZkqfEr,billgates
4/29/2020 3:02,1.25533E+18,"RT @gatesfoundation: Developing a vaccine against #COVID19 is among the first steps to a solution.

Distributing the vaccine safely, effect…",billgates
